city_id,State,County,State Abbreviation,city_name_id,city_state,city,City,state_id,county_name,state_name,lat,lng
340,California,Los Angeles County,CA,"Lynwood, California, Los Angeles County","Lynwood, California",Lynwood,Lynwood,CA,Los Angeles,California,33.924,-118.2016
341,Colorado,Larimer County,CO,"Loveland, Colorado, Larimer County","Loveland, Colorado",Loveland,Loveland,CO,Larimer,Colorado,40.4166,-105.0623
342,Rhode Island,Providence County,RI,"Pawtucket, Rhode Island, Providence County","Pawtucket, Rhode Island",Pawtucket,Pawtucket,RI,Providence,Rhode Island,41.8744,-71.3743
343,Florida,Palm Beach County,FL,"Boynton Beach, Florida, Palm Beach County","Boynton Beach, Florida",Boynton Beach,Boynton Beach,FL,Palm Beach,Florida,26.5281,-80.0811
344,Wisconsin,Waukesha County,WI,"Waukesha, Wisconsin, Waukesha County","Waukesha, Wisconsin",Waukesha,Waukesha,WI,Waukesha,Wisconsin,43.0087,-88.2464
345,California,San Bernardino County,CA,"Apple Valley, California, San Bernardino County","Apple Valley, California",Apple Valley,Apple Valley,CA,San Bernardino,California,34.5352,-117.2109
346,New Jersey,Passaic County,NJ,"Passaic, New Jersey, Passaic County","Passaic, New Jersey",Passaic,Passaic,NJ,Passaic,New Jersey,40.8574,-74.1282
347,Utah,Davis County,UT,"Layton, Utah, Davis County","Layton, Utah",Layton,Layton,UT,Davis,Utah,41.077,-111.962
348,California,Stanislaus County,CA,"Turlock, California, Stanislaus County","Turlock, California",Turlock,Turlock,CA,Stanislaus,California,37.5053,-120.8588
349,Texas,Fort Bend County,TX,"Missouri City, Texas, Fort Bend County","Missouri City, Texas",Missouri City,Missouri City,TX,Fort Bend,Texas,29.563,-95.5365
350,California,San Bernardino County,CA,"Redlands, California, San Bernardino County","Redlands, California",Redlands,Redlands,CA,San Bernardino,California,34.0512,-117.1712
351,Florida,Broward County,FL,"Lauderhill, Florida, Broward County","Lauderhill, Florida",Lauderhill,Lauderhill,FL,Broward,Florida,26.1605,-80.2241
352,California,Santa Clara County,CA,"Milpitas, California, Santa Clara County","Milpitas, California",Milpitas,Milpitas,CA,Santa Clara,California,37.4336,-121.8921
353,Tennessee,Williamson County,TN,"Franklin, Tennessee, Williamson County","Franklin, Tennessee",Franklin,Franklin,TN,Williamson,Tennessee,35.92,-86.8516
354,Texas,Denton County,TX,"Flower Mound, Texas, Denton County","Flower Mound, Texas",Flower Mound,Flower Mound,TX,Denton,Texas,33.0343,-97.1146
355,Florida,Broward County,FL,"Weston, Florida, Broward County","Weston, Florida",Weston,Weston,FL,Broward,Florida,26.1006,-80.4054
356,New Jersey,Hudson County,NJ,"Union City, New Jersey, Hudson County","Union City, New Jersey",Union City,Union City,NJ,Hudson,New Jersey,40.7675,-74.0323
357,New York,Westchester County,NY,"Mount Vernon, New York, Westchester County","Mount Vernon, New York",Mount Vernon,Mount Vernon,NY,Westchester,New York,40.9136,-73.8291
358,Florida,Lee County,FL,"Fort Myers, Florida, Lee County","Fort Myers, Florida",Fort Myers,Fort Myers,FL,Lee,Florida,26.6194,-81.8302
359,California,Sacramento County,CA,"Rancho Cordova, California, Sacramento County","Rancho Cordova, California",Rancho Cordova,Rancho Cordova,CA,Sacramento,California,38.5737,-121.2527
360,California,Los Angeles County,CA,"Redondo Beach, California, Los Angeles County","Redondo Beach, California",Redondo Beach,Redondo Beach,CA,Los Angeles,California,33.8577,-118.3765
361,Tennessee,Madison County,TN,"Jackson, Tennessee, Madison County","Jackson, Tennessee",Jackson,Jackson,TN,Madison,Tennessee,35.6538,-88.8354
362,Washington,Franklin County,WA,"Pasco, Washington, Franklin County","Pasco, Washington",Pasco,Pasco,WA,Franklin,Washington,46.2506,-119.1305
363,Texas,Tarrant County,TX,"North Richland Hills, Texas, Tarrant County","North Richland Hills, Texas",North Richland Hills,North Richland Hills,TX,Tarrant,Texas,32.8604,-97.218
364,California,Orange County,CA,"Yorba Linda, California, Orange County","Yorba Linda, California",Yorba Linda,Yorba Linda,CA,Orange,California,33.889,-117.7714
365,California,Contra Costa County,CA,"Walnut Creek, California, Contra Costa County","Walnut Creek, California",Walnut Creek,Walnut Creek,CA,Contra Costa,California,37.9024,-122.0399
366,California,Contra Costa County,CA,"Pittsburg, California, Contra Costa County","Pittsburg, California",Pittsburg,Pittsburg,CA,Contra Costa,California,38.0182,-121.8965
367,California,Santa Clara County,CA,"Palo Alto, California, Santa Clara County","Palo Alto, California",Palo Alto,Palo Alto,CA,Santa Clara,California,37.3905,-122.1468
368,Maine,Cumberland County,ME,"Portland, Maine, Cumberland County","Portland, Maine",Portland,Portland,ME,Cumberland,Maine,43.6773,-70.2715
369,California,Yolo County,CA,"Davis, California, Yolo County","Davis, California",Davis,Davis,CA,Yolo,California,38.5553,-121.737
370,California,San Mateo County,CA,"South San Francisco, California, San Mateo County","South San Francisco, California",South San Francisco,South San Francisco,CA,San Mateo,California,37.6538,-122.4196
371,California,Ventura County,CA,"Camarillo, California, Ventura County","Camarillo, California",Camarillo,Camarillo,CA,Ventura,California,34.223,-119.0321
372,Arkansas,Pulaski County,AR,"North Little Rock, Arkansas, Pulaski County","North Little Rock, Arkansas",North Little Rock,North Little Rock,AR,Pulaski,Arkansas,34.7807,-92.2371
373,New York,Schenectady County,NY,"Schenectady, New York, Schenectady County","Schenectady, New York",Schenectady,Schenectady,NY,Schenectady,New York,42.8025,-73.9275
374,Minnesota,Washington County,MN,"Woodbury, Minnesota, Washington County","Woodbury, Minnesota",Woodbury,Woodbury,MN,Washington,Minnesota,44.9057,-92.923
375,Minnesota,Dakota County,MN,"Eagan, Minnesota, Dakota County","Eagan, Minnesota",Eagan,Eagan,MN,Dakota,Minnesota,44.817,-93.1638
376,Minnesota,Hennepin County,MN,"Maple Grove, Minnesota, Hennepin County","Maple Grove, Minnesota",Maple Grove,Maple Grove,MN,Hennepin,Minnesota,45.1089,-93.4626
377,Ohio,Mahoning County,OH,"Youngstown, Ohio, Mahoning County","Youngstown, Ohio",Youngstown,Youngstown,OH,Mahoning,Ohio,41.0993,-80.6463
378,Illinois,Cook County,IL,"Skokie, Illinois, Cook County","Skokie, Illinois",Skokie,Skokie,IL,Cook,Illinois,42.036,-87.74
379,Florida,Osceola County,FL,"Kissimmee, Florida, Osceola County","Kissimmee, Florida",Kissimmee,Kissimmee,FL,Osceola,Florida,28.3041,-81.4169
380,Tennessee,Washington County,TN,"Johnson City, Tennessee, Washington County","Johnson City, Tennessee",Johnson City,Johnson City,TN,Washington,Tennessee,36.3406,-82.3806
381,California,Orange County,CA,"San Clemente, California, Orange County","San Clemente, California",San Clemente,San Clemente,CA,Orange,California,33.4499,-117.6102
382,New Jersey,Hudson County,NJ,"Bayonne, New Jersey, Hudson County","Bayonne, New Jersey",Bayonne,Bayonne,NJ,Hudson,New Jersey,40.6668,-74.1158
383,California,Orange County,CA,"Laguna Niguel, California, Orange County","Laguna Niguel, California",Laguna Niguel,Laguna Niguel,CA,Orange,California,33.5275,-117.705
384,New Jersey,Essex County,NJ,"East Orange, New Jersey, Essex County","East Orange, New Jersey",East Orange,East Orange,NJ,Essex,New Jersey,40.7651,-74.2117
385,Florida,Miami-Dade County,FL,"Homestead, Florida, Miami-Dade County","Homestead, Florida",Homestead,Homestead,FL,Miami-Dade,Florida,25.4665,-80.4472
386,Florida,Palm Beach County,FL,"Delray Beach, Florida, Palm Beach County","Delray Beach, Florida",Delray Beach,Delray Beach,FL,Palm Beach,Florida,26.455,-80.0905
387,Arkansas,Faulkner County,AR,"Conway, Arkansas, Faulkner County","Conway, Arkansas",Conway,Conway,AR,Faulkner,Arkansas,35.0753,-92.4692
388,California,Los Angeles County,CA,"Pico Rivera, California, Los Angeles County","Pico Rivera, California",Pico Rivera,Pico Rivera,CA,Los Angeles,California,33.9901,-118.0888
389,Ohio,Lorain County,OH,"Lorain, Ohio, Lorain County","Lorain, Ohio",Lorain,Lorain,OH,Lorain,Ohio,41.4409,-82.184
390,California,San Joaquin County,CA,"Lodi, California, San Joaquin County","Lodi, California",Lodi,Lodi,CA,San Joaquin,California,38.1218,-121.2932
391,Washington,Snohomish County,WA,"Marysville, Washington, Snohomish County","Marysville, Washington",Marysville,Marysville,WA,Snohomish,Washington,48.0809,-122.1561
392,Florida,Broward County,FL,"Tamarac, Florida, Broward County","Tamarac, Florida",Tamarac,Tamarac,FL,Broward,Florida,26.2056,-80.2539
393,Texas,Montgomery County,TX,"Conroe, Texas, Montgomery County","Conroe, Texas",Conroe,Conroe,TX,Montgomery,Texas,30.3238,-95.4824
394,California,Santa Cruz County,CA,"Santa Cruz, California, Santa Cruz County","Santa Cruz, California",Santa Cruz,Santa Cruz,CA,Santa Cruz,California,36.9789,-122.0346
395,Minnesota,Hennepin County,MN,"Eden Prairie, Minnesota, Hennepin County","Eden Prairie, Minnesota",Eden Prairie,Eden Prairie,MN,Hennepin,Minnesota,44.8488,-93.4595
396,Florida,Volusia County,FL,"Daytona Beach, Florida, Volusia County","Daytona Beach, Florida",Daytona Beach,Daytona Beach,FL,Volusia,Florida,29.1995,-81.0982
397,Georgia,Fulton County,GA,"Alpharetta, Georgia, Fulton County","Alpharetta, Georgia",Alpharetta,Alpharetta,GA,Fulton,Georgia,34.0704,-84.2738
398,Massachusetts,Middlesex County,MA,"Waltham, Massachusetts, Middlesex County","Waltham, Massachusetts",Waltham,Waltham,MA,Middlesex,Massachusetts,42.3889,-71.2423
399,Minnesota,Anoka County,MN,"Coon Rapids, Minnesota, Anoka County","Coon Rapids, Minnesota",Coon Rapids,Coon Rapids,MN,Anoka,Minnesota,45.1755,-93.3094
400,Massachusetts,Essex County,MA,"Haverhill, Massachusetts, Essex County","Haverhill, Massachusetts",Haverhill,Haverhill,MA,Essex,Massachusetts,42.7838,-71.0871
401,Michigan,Wayne County,MI,"Taylor, Michigan, Wayne County","Taylor, Michigan",Taylor,Taylor,MI,Wayne,Michigan,42.226,-83.2688
402,New York,Oneida County,NY,"Utica, New York, Oneida County","Utica, New York",Utica,Utica,NY,Oneida,New York,43.0962,-75.2261
403,California,Orange County,CA,"La Habra, California, Orange County","La Habra, California",La Habra,La Habra,CA,Orange,California,33.9282,-117.9515
404,California,San Diego County,CA,"Encinitas, California, San Diego County","Encinitas, California",Encinitas,Encinitas,CA,San Diego,California,33.0492,-117.261
405,Kentucky,Warren County,KY,"Bowling Green, Kentucky, Warren County","Bowling Green, Kentucky",Bowling Green,Bowling Green,KY,Warren,Kentucky,36.9716,-86.4378
406,Minnesota,Dakota County,MN,"Burnsville, Minnesota, Dakota County","Burnsville, Minnesota",Burnsville,Burnsville,MN,Dakota,Minnesota,44.7648,-93.2793
407,South Carolina,Greenville County,SC,"Greenville, South Carolina, Greenville County","Greenville, South Carolina",Greenville,Greenville,SC,Greenville,South Carolina,34.8354,-82.3646
408,Iowa,Polk County,IA,"West Des Moines, Iowa, Polk County","West Des Moines, Iowa",West Des Moines,West Des Moines,IA,Polk,Iowa,41.5521,-93.7806
409,Texas,Williamson County,TX,"Cedar Park, Texas, Williamson County","Cedar Park, Texas",Cedar Park,Cedar Park,TX,Williamson,Texas,30.5105,-97.8197
410,California,Tulare County,CA,"Tulare, California, Tulare County","Tulare, California",Tulare,Tulare,CA,Tulare,California,36.1995,-119.34
411,California,Los Angeles County,CA,"Monterey Park, California, Los Angeles County","Monterey Park, California",Monterey Park,Monterey Park,CA,Los Angeles,California,34.0497,-118.1326
412,New Jersey,Cumberland County,NJ,"Vineland, New Jersey, Cumberland County","Vineland, New Jersey",Vineland,Vineland,NJ,Cumberland,New Jersey,39.4653,-74.9981
413,Florida,Miami-Dade County,FL,"North Miami, Florida, Miami-Dade County","North Miami, Florida",North Miami,North Miami,FL,Miami-Dade,Florida,25.9008,-80.1686
414,Texas,Tarrant County,TX,"Mansfield, Texas, Tarrant County","Mansfield, Texas",Mansfield,Mansfield,TX,Tarrant,Texas,32.569,-97.1213
415,Wisconsin,Milwaukee County,WI,"West Allis, Wisconsin, Milwaukee County","West Allis, Wisconsin",West Allis,West Allis,WI,Milwaukee,Wisconsin,43.0068,-88.0296
416,Connecticut,Hartford County,CT,"Bristol, Connecticut, Hartford County","Bristol, Connecticut",Bristol,Bristol,CT,Hartford,Connecticut,41.6812,-72.9407
417,Massachusetts,Middlesex County,MA,"Malden, Massachusetts, Middlesex County","Malden, Massachusetts",Malden,Malden,MA,Middlesex,Massachusetts,42.4305,-71.0576
418,Connecticut,New Haven County,CT,"Meriden, Connecticut, New Haven County","Meriden, Connecticut",Meriden,Meriden,CT,New Haven,Connecticut,41.5369,-72.7946
419,Minnesota,Anoka County,MN,"Blaine, Minnesota, Anoka County","Blaine, Minnesota",Blaine,Blaine,MN,Anoka,Minnesota,45.1696,-93.2077
420,Florida,Palm Beach County,FL,"Wellington, Florida, Palm Beach County","Wellington, Florida",Wellington,Wellington,FL,Palm Beach,Florida,26.6461,-80.2699
421,California,Santa Clara County,CA,"Cupertino, California, Santa Clara County","Cupertino, California",Cupertino,Cupertino,CA,Santa Clara,California,37.3168,-122.0466
422,Oregon,Lane County,OR,"Springfield, Oregon, Lane County","Springfield, Oregon",Springfield,Springfield,OR,Lane,Oregon,44.0538,-122.9811
423,Arkansas,Benton County,AR,"Rogers, Arkansas, Benton County","Rogers, Arkansas",Rogers,Rogers,AR,Benton,Arkansas,36.317,-94.1531
424,California,Los Angeles County,CA,"Gardena, California, Los Angeles County","Gardena, California",Gardena,Gardena,CA,Los Angeles,California,33.8943,-118.3072
425,Michigan,Oakland County,MI,"Pontiac, Michigan, Oakland County","Pontiac, Michigan",Pontiac,Pontiac,MI,Oakland,Michigan,42.6493,-83.2878
426,California,San Diego County,CA,"National City, California, San Diego County","National City, California",National City,National City,CA,San Diego,California,32.6654,-117.0983
427,Colorado,Mesa County,CO,"Grand Junction, Colorado, Mesa County","Grand Junction, Colorado",Grand Junction,Grand Junction,CO,Mesa,Colorado,39.0877,-108.5673
428,California,Placer County,CA,"Rocklin, California, Placer County","Rocklin, California",Rocklin,Rocklin,CA,Placer,California,38.8075,-121.2489
429,Colorado,Broomfield County,CO,"Broomfield, Colorado, Broomfield County","Broomfield, Colorado",Broomfield,Broomfield,CO,Broomfield,Colorado,39.9542,-105.0526
430,California,Sonoma County,CA,"Petaluma, California, Sonoma County","Petaluma, California",Petaluma,Petaluma,CA,Sonoma,California,38.2423,-122.6266
431,Utah,Salt Lake County,UT,"South Jordan, Utah, Salt Lake County","South Jordan, Utah",South Jordan,South Jordan,UT,Salt Lake,Utah,40.557,-111.9784
432,Ohio,Clark County,OH,"Springfield, Ohio, Clark County","Springfield, Ohio",Springfield,Springfield,OH,Clark,Ohio,39.93,-83.7959
433,Florida,Sarasota County,FL,"North Port, Florida, Sarasota County","North Port, Florida",North Port,North Port,FL,Sarasota,Florida,27.0576,-82.1977
434,Washington,Pierce County,WA,"Lakewood, Washington, Pierce County","Lakewood, Washington",Lakewood,Lakewood,WA,Pierce,Washington,47.1628,-122.5299
435,Georgia,Cobb County,GA,"Marietta, Georgia, Cobb County","Marietta, Georgia",Marietta,Marietta,GA,Cobb,Georgia,33.9533,-84.5422
436,California,Marin County,CA,"San Rafael, California, Marin County","San Rafael, California",San Rafael,San Rafael,CA,Marin,California,37.9905,-122.5221
437,Michigan,Oakland County,MI,"Royal Oak, Michigan, Oakland County","Royal Oak, Michigan",Royal Oak,Royal Oak,MI,Oakland,Michigan,42.5084,-83.1539
438,California,Los Angeles County,CA,"Huntington Park, California, Los Angeles County","Huntington Park, California",Huntington Park,Huntington Park,CA,Los Angeles,California,33.98,-118.2167
439,California,San Diego County,CA,"La Mesa, California, San Diego County","La Mesa, California",La Mesa,La Mesa,CA,San Diego,California,32.7703,-117.0204
440,Alabama,Lee County,AL,"Auburn, Alabama, Lee County","Auburn, Alabama",Auburn,Auburn,AL,Lee,Alabama,32.6087,-85.4903
441,Minnesota,Dakota County,MN,"Lakeville, Minnesota, Dakota County","Lakeville, Minnesota",Lakeville,Lakeville,MN,Dakota,Minnesota,44.6774,-93.252
442,Kentucky,Daviess County,KY,"Owensboro, Kentucky, Daviess County","Owensboro, Kentucky",Owensboro,Owensboro,KY,Daviess,Kentucky,37.7575,-87.1172
443,Oklahoma,Cleveland County,OK,"Moore, Oklahoma, Cleveland County","Moore, Oklahoma",Moore,Moore,OK,Cleveland,Oklahoma,35.3293,-97.4757
444,Florida,Palm Beach County,FL,"Jupiter, Florida, Palm Beach County","Jupiter, Florida",Jupiter,Jupiter,FL,Palm Beach,Florida,26.92,-80.1128
445,Idaho,Bonneville County,ID,"Idaho Falls, Idaho, Bonneville County","Idaho Falls, Idaho",Idaho Falls,Idaho Falls,ID,Bonneville,Idaho,43.4871,-112.0362
446,Tennessee,Shelby County,TN,"Bartlett, Tennessee, Shelby County","Bartlett, Tennessee",Bartlett,Bartlett,TN,Shelby,Tennessee,35.2337,-89.8195
447,Texas,Dallas County,TX,"Rowlett, Texas, Dallas County","Rowlett, Texas",Rowlett,Rowlett,TX,Dallas,Texas,32.9155,-96.5489
448,Michigan,Oakland County,MI,"Novi, Michigan, Oakland County","Novi, Michigan",Novi,Novi,MI,Oakland,Michigan,42.4786,-83.4893
449,California,Los Angeles County,CA,"Arcadia, California, Los Angeles County","Arcadia, California",Arcadia,Arcadia,CA,Los Angeles,California,34.1342,-118.0373
450,Washington,King County,WA,"Redmond, Washington, King County","Redmond, Washington",Redmond,Redmond,WA,King,Washington,47.6763,-122.1169
451,California,Riverside County,CA,"Lake Elsinore, California, Riverside County","Lake Elsinore, California",Lake Elsinore,Lake Elsinore,CA,Riverside,California,33.6847,-117.3344
452,Illinois,Cook County,IL,"Tinley Park, Illinois, Cook County","Tinley Park, Illinois",Tinley Park,Tinley Park,IL,Cook,Illinois,41.567,-87.8049
453,Florida,Volusia County,FL,"Port Orange, Florida, Volusia County","Port Orange, Florida",Port Orange,Port Orange,FL,Volusia,Florida,29.1085,-81.0137
454,Massachusetts,Middlesex County,MA,"Medford, Massachusetts, Middlesex County","Medford, Massachusetts",Medford,Medford,MA,Middlesex,Massachusetts,42.4234,-71.1087
455,North Carolina,Nash County,NC,"Rocky Mount, North Carolina, Nash County","Rocky Mount, North Carolina",Rocky Mount,Rocky Mount,NC,Nash,North Carolina,35.9685,-77.804
456,Florida,Broward County,FL,"Coconut Creek, Florida, Broward County","Coconut Creek, Florida",Coconut Creek,Coconut Creek,FL,Broward,Florida,26.2803,-80.1842
457,Oklahoma,Oklahoma County,OK,"Midwest City, Oklahoma, Oklahoma County","Midwest City, Oklahoma",Midwest City,Midwest City,OK,Oklahoma,Oklahoma,35.463,-97.371
458,California,Orange County,CA,"Fountain Valley, California, Orange County","Fountain Valley, California",Fountain Valley,Fountain Valley,CA,Orange,California,33.7105,-117.9514
459,Arizona,Maricopa County,AZ,"Buckeye, Arizona, Maricopa County","Buckeye, Arizona",Buckeye,Buckeye,AZ,Maricopa,Arizona,33.4314,-112.6429
460,Michigan,Wayne County,MI,"Dearborn Heights, Michigan, Wayne County","Dearborn Heights, Michigan",Dearborn Heights,Dearborn Heights,MI,Wayne,Michigan,42.3164,-83.2769
461,California,Yolo County,CA,"Woodland, California, Yolo County","Woodland, California",Woodland,Woodland,CA,Yolo,California,38.6712,-121.75
462,Georgia,Lowndes County,GA,"Valdosta, Georgia, Lowndes County","Valdosta, Georgia",Valdosta,Valdosta,GA,Lowndes,Georgia,30.8502,-83.2788
463,California,Los Angeles County,CA,"Diamond Bar, California, Los Angeles County","Diamond Bar, California",Diamond Bar,Diamond Bar,CA,Los Angeles,California,33.9992,-117.8161
464,California,San Diego County,CA,"Santee, California, San Diego County","Santee, California",Santee,Santee,CA,San Diego,California,32.8554,-116.9851
465,Massachusetts,Bristol County,MA,"Taunton, Massachusetts, Bristol County","Taunton, Massachusetts",Taunton,Taunton,MA,Bristol,Massachusetts,41.9036,-71.0943
466,Florida,Seminole County,FL,"Sanford, Florida, Seminole County","Sanford, Florida",Sanford,Sanford,FL,Seminole,Florida,28.7891,-81.2757
467,New Jersey,Middlesex County,NJ,"New Brunswick, New Jersey, Middlesex County","New Brunswick, New Jersey",New Brunswick,New Brunswick,NJ,Middlesex,New Jersey,40.487,-74.445
468,Massachusetts,Hampden County,MA,"Chicopee, Massachusetts, Hampden County","Chicopee, Massachusetts",Chicopee,Chicopee,MA,Hampden,Massachusetts,42.1764,-72.5719
469,Florida,Broward County,FL,"Margate, Florida, Broward County","Margate, Florida",Margate,Margate,FL,Broward,Florida,26.2466,-80.2119
470,Oregon,Benton County,OR,"Corvallis, Oregon, Benton County","Corvallis, Oregon",Corvallis,Corvallis,OR,Benton,Oregon,44.5698,-123.2779
471,California,Riverside County,CA,"Eastvale, California, Riverside County","Eastvale, California",Eastvale,Eastvale,CA,Riverside,California,33.9617,-117.5803
472,California,Tulare County,CA,"Porterville, California, Tulare County","Porterville, California",Porterville,Porterville,CA,Tulare,California,36.0643,-119.0338
473,Connecticut,New Haven County,CT,"West Haven, Connecticut, New Haven County","West Haven, Connecticut",West Haven,West Haven,CT,New Haven,Connecticut,41.2739,-72.9672
474,California,Contra Costa County,CA,"Brentwood, California, Contra Costa County","Brentwood, California",Brentwood,Brentwood,CA,Contra Costa,California,37.9356,-121.719
475,California,Los Angeles County,CA,"Paramount, California, Los Angeles County","Paramount, California",Paramount,Paramount,CA,Los Angeles,California,33.8977,-118.1651
476,Washington,King County,WA,"Shoreline, Washington, King County","Shoreline, Washington",Shoreline,Shoreline,WA,King,Washington,47.7564,-122.3426
477,Illinois,McLean County,IL,"Normal, Illinois, McLean County","Normal, Illinois",Normal,Normal,IL,McLean,Illinois,40.5217,-88.9884
478,California,Los Angeles County,CA,"Rosemead, California, Los Angeles County","Rosemead, California",Rosemead,Rosemead,CA,Los Angeles,California,34.0689,-118.0823
479,California,San Bernardino County,CA,"Highland, California, San Bernardino County","Highland, California",Highland,Highland,CA,San Bernardino,California,34.1113,-117.165
480,California,Marin County,CA,"Novato, California, Marin County","Novato, California",Novato,Novato,CA,Marin,California,38.092,-122.5575
481,Tennessee,Sumner County,TN,"Hendersonville, Tennessee, Sumner County","Hendersonville, Tennessee",Hendersonville,Hendersonville,TN,Sumner,Tennessee,36.3063,-86.5997
482,Ohio,Lorain County,OH,"Elyria, Ohio, Lorain County","Elyria, Ohio",Elyria,Elyria,OH,Lorain,Ohio,41.376,-82.106
483,Massachusetts,Suffolk County,MA,"Revere, Massachusetts, Suffolk County","Revere, Massachusetts",Revere,Revere,MA,Suffolk,Massachusetts,42.4189,-71.004
484,Texas,Travis County,TX,"Pflugerville, Texas, Travis County","Pflugerville, Texas",Pflugerville,Pflugerville,TX,Travis,Texas,30.4515,-97.6018
485,Nebraska,Sarpy County,NE,"Bellevue, Nebraska, Sarpy County","Bellevue, Nebraska",Bellevue,Bellevue,NE,Sarpy,Nebraska,41.1485,-95.939
486,Georgia,Cobb County,GA,"Smyrna, Georgia, Cobb County","Smyrna, Georgia",Smyrna,Smyrna,GA,Cobb,Georgia,33.8633,-84.5168
487,Florida,Sarasota County,FL,"Sarasota, Florida, Sarasota County","Sarasota, Florida",Sarasota,Sarasota,FL,Sarasota,Florida,27.3387,-82.5432
488,Missouri,Jackson County,MO,"Blue Springs, Missouri, Jackson County","Blue Springs, Missouri",Blue Springs,Blue Springs,MO,Jackson,Missouri,39.0124,-94.2721
489,California,San Bernardino County,CA,"Colton, California, San Bernardino County","Colton, California",Colton,Colton,CA,San Bernardino,California,34.0538,-117.3255
490,Texas,Tarrant County,TX,"Euless, Texas, Tarrant County","Euless, Texas",Euless,Euless,TX,Tarrant,Texas,32.8508,-97.08
491,Colorado,Douglas County,CO,"Castle Rock, Colorado, Douglas County","Castle Rock, Colorado",Castle Rock,Castle Rock,CO,Douglas,Colorado,39.3763,-104.8535
492,California,Riverside County,CA,"Cathedral City, California, Riverside County","Cathedral City, California",Cathedral City,Cathedral City,CA,Riverside,California,33.8362,-116.4642
493,Tennessee,Sullivan County,TN,"Kingsport, Tennessee, Sullivan County","Kingsport, Tennessee",Kingsport,Kingsport,TN,Sullivan,Tennessee,36.5224,-82.5454
494,Arizona,Mohave County,AZ,"Lake Havasu City, Arizona, Mohave County","Lake Havasu City, Arizona",Lake Havasu City,Lake Havasu City,AZ,Mohave,Arizona,34.5006,-114.3113
495,Florida,Escambia County,FL,"Pensacola, Florida, Escambia County","Pensacola, Florida",Pensacola,Pensacola,FL,Escambia,Florida,30.4413,-87.1911
496,New Jersey,Hudson County,NJ,"Hoboken, New Jersey, Hudson County","Hoboken, New Jersey",Hoboken,Hoboken,NJ,Hudson,New Jersey,40.7452,-74.0281
497,California,San Bernardino County,CA,"Yucaipa, California, San Bernardino County","Yucaipa, California",Yucaipa,Yucaipa,CA,San Bernardino,California,34.0336,-117.0429
498,California,Santa Cruz County,CA,"Watsonville, California, Santa Cruz County","Watsonville, California",Watsonville,Watsonville,CA,Santa Cruz,California,36.9206,-121.7708
499,California,Kern County,CA,"Delano, California, Kern County","Delano, California",Delano,Delano,CA,Kern,California,35.7662,-119.2635
500,California,Orange County,CA,"Placentia, California, Orange County","Placentia, California",Placentia,Placentia,CA,Orange,California,33.8807,-117.8553
501,New Jersey,Hudson County,NJ,"West New York, New Jersey, Hudson County","West New York, New Jersey",West New York,West New York,NJ,Hudson,New Jersey,40.7857,-74.0094
502,California,Alameda County,CA,"Dublin, California, Alameda County","Dublin, California",Dublin,Dublin,CA,Alameda,California,37.7161,-121.8963
503,Massachusetts,Essex County,MA,"Peabody, Massachusetts, Essex County","Peabody, Massachusetts",Peabody,Peabody,MA,Essex,Massachusetts,42.5335,-70.9725
504,New Jersey,Middlesex County,NJ,"Perth Amboy, New Jersey, Middlesex County","Perth Amboy, New Jersey",Perth Amboy,Perth Amboy,NJ,Middlesex,New Jersey,40.5202,-74.2724
505,Michigan,Calhoun County,MI,"Battle Creek, Michigan, Calhoun County","Battle Creek, Michigan",Battle Creek,Battle Creek,MI,Calhoun,Michigan,42.2985,-85.2296
506,Florida,Manatee County,FL,"Bradenton, Florida, Manatee County","Bradenton, Florida",Bradenton,Bradenton,FL,Manatee,Florida,27.4901,-82.5757
