city_id,State,County,State Abbreviation,city_name_id,city_state,city,City,state_id,county_name,state_name,lat,lng
173,California,Los Angeles County,CA,"Inglewood, California, Los Angeles County","Inglewood, California",Inglewood,Inglewood,CA,Los Angeles,California,33.9566,-118.3444
174,Florida,Miami-Dade County,FL,"Miami Gardens, Florida, Miami-Dade County","Miami Gardens, Florida",Miami Gardens,Miami Gardens,FL,Miami-Dade,Florida,25.9433,-80.2426
175,California,San Diego County,CA,"Carlsbad, California, San Diego County","Carlsbad, California",Carlsbad,Carlsbad,CA,San Diego,California,33.1246,-117.2834
176,Minnesota,Olmsted County,MN,"Rochester, Minnesota, Olmsted County","Rochester, Minnesota",Rochester,Rochester,MN,Olmsted,Minnesota,44.0154,-92.478
177,New Hampshire,Hillsborough County,NH,"Manchester, New Hampshire, Hillsborough County","Manchester, New Hampshire",Manchester,Manchester,NH,Hillsborough,New Hampshire,42.9848,-71.4447
178,Utah,Salt Lake County,UT,"West Jordan, Utah, Salt Lake County","West Jordan, Utah",West Jordan,West Jordan,UT,Salt Lake,Utah,40.6024,-112.0008
179,Texas,Williamson County,TX,"Round Rock, Texas, Williamson County","Round Rock, Texas",Round Rock,Round Rock,TX,Williamson,Texas,30.527,-97.6642
180,Florida,Pinellas County,FL,"Clearwater, Florida, Pinellas County","Clearwater, Florida",Clearwater,Clearwater,FL,Pinellas,Florida,27.979,-82.7623
181,Connecticut,New Haven County,CT,"Waterbury, Connecticut, New Haven County","Waterbury, Connecticut",Waterbury,Waterbury,CT,New Haven,Connecticut,41.5582,-73.0361
182,Oregon,Multnomah County,OR,"Gresham, Oregon, Multnomah County","Gresham, Oregon",Gresham,Gresham,OR,Multnomah,Oregon,45.5021,-122.4413
183,California,Solano County,CA,"Fairfield, California, Solano County","Fairfield, California",Fairfield,Fairfield,CA,Solano,California,38.2583,-122.0335
184,Massachusetts,Middlesex County,MA,"Lowell, Massachusetts, Middlesex County","Lowell, Massachusetts",Lowell,Lowell,MA,Middlesex,Massachusetts,42.6389,-71.3217
185,Colorado,Pueblo County,CO,"Pueblo, Colorado, Pueblo County","Pueblo, Colorado",Pueblo,Pueblo,CO,Pueblo,Colorado,38.2701,-104.6114
186,North Carolina,Guilford County,NC,"High Point, North Carolina, Guilford County","High Point, North Carolina",High Point,High Point,NC,Guilford,North Carolina,35.991,-79.9937
187,California,Los Angeles County,CA,"West Covina, California, Los Angeles County","West Covina, California",West Covina,West Covina,CA,Los Angeles,California,34.0555,-117.9113
188,California,Contra Costa County,CA,"Richmond, California, Contra Costa County","Richmond, California",Richmond,Richmond,CA,Contra Costa,California,37.9477,-122.3389
189,California,Riverside County,CA,"Murrieta, California, Riverside County","Murrieta, California",Murrieta,Murrieta,CA,Riverside,California,33.5719,-117.1909
190,Massachusetts,Middlesex County,MA,"Cambridge, Massachusetts, Middlesex County","Cambridge, Massachusetts",Cambridge,Cambridge,MA,Middlesex,Massachusetts,42.3759,-71.1185
191,California,Contra Costa County,CA,"Antioch, California, Contra Costa County","Antioch, California",Antioch,Antioch,CA,Contra Costa,California,37.9787,-121.796
192,California,Riverside County,CA,"Temecula, California, Riverside County","Temecula, California",Temecula,Temecula,CA,Riverside,California,33.4928,-117.1315
193,California,Los Angeles County,CA,"Norwalk, California, Los Angeles County","Norwalk, California",Norwalk,Norwalk,CA,Los Angeles,California,33.9069,-118.0829
194,Colorado,Arapahoe County,CO,"Centennial, Colorado, Arapahoe County","Centennial, Colorado",Centennial,Centennial,CO,Arapahoe,Colorado,39.5926,-104.8673
195,Washington,Snohomish County,WA,"Everett, Washington, Snohomish County","Everett, Washington",Everett,Everett,WA,Snohomish,Washington,47.9525,-122.1669
196,Florida,Brevard County,FL,"Palm Bay, Florida, Brevard County","Palm Bay, Florida",Palm Bay,Palm Bay,FL,Brevard,Florida,27.9631,-80.6593
197,California,San Mateo County,CA,"Daly City, California, San Mateo County","Daly City, California",Daly City,Daly City,CA,San Mateo,California,37.6862,-122.4685
198,California,Los Angeles County,CA,"Burbank, California, Los Angeles County","Burbank, California",Burbank,Burbank,CA,Los Angeles,California,34.1879,-118.3235
199,Texas,Dallas County,TX,"Richardson, Texas, Dallas County","Richardson, Texas",Richardson,Richardson,TX,Dallas,Texas,32.9716,-96.7093
200,Florida,Broward County,FL,"Pompano Beach, Florida, Broward County","Pompano Beach, Florida",Pompano Beach,Pompano Beach,FL,Broward,Florida,26.2428,-80.1312
201,South Carolina,Charleston County,SC,"North Charleston, South Carolina, Charleston County","North Charleston, South Carolina",North Charleston,North Charleston,SC,Charleston,South Carolina,32.9067,-80.0722
202,Colorado,Boulder County,CO,"Boulder, Colorado, Boulder County","Boulder, Colorado",Boulder,Boulder,CO,Boulder,Colorado,40.0248,-105.2524
203,Florida,Palm Beach County,FL,"West Palm Beach, Florida, Palm Beach County","West Palm Beach, Florida",West Palm Beach,West Palm Beach,FL,Palm Beach,Florida,26.7469,-80.132
204,California,Santa Barbara County,CA,"Santa Maria, California, Santa Barbara County","Santa Maria, California",Santa Maria,Santa Maria,CA,Santa Barbara,California,34.9333,-120.4431
205,California,San Diego County,CA,"El Cajon, California, San Diego County","El Cajon, California",El Cajon,El Cajon,CA,San Diego,California,32.8017,-116.9604
206,California,San Bernardino County,CA,"Rialto, California, San Bernardino County","Rialto, California",Rialto,Rialto,CA,San Bernardino,California,34.1175,-117.3892
207,California,San Mateo County,CA,"San Mateo, California, San Mateo County","San Mateo, California",San Mateo,San Mateo,CA,San Mateo,California,37.5522,-122.3121
208,Texas,Denton County,TX,"Lewisville, Texas, Denton County","Lewisville, Texas",Lewisville,Lewisville,TX,Denton,Texas,33.0454,-96.9815
209,Florida,Polk County,FL,"Lakeland, Florida, Polk County","Lakeland, Florida",Lakeland,Lakeland,FL,Polk,Florida,28.0557,-81.9545
210,Texas,Brazoria County,TX,"Pearland, Texas, Brazoria County","Pearland, Texas",Pearland,Pearland,TX,Brazoria,Texas,29.5581,-95.3218
211,Wisconsin,Kenosha County,WI,"Kenosha, Wisconsin, Kenosha County","Kenosha, Wisconsin",Kenosha,Kenosha,WI,Kenosha,Wisconsin,42.5865,-87.8773
212,Georgia,Fulton County,GA,"Sandy Springs, Georgia, Fulton County","Sandy Springs, Georgia",Sandy Springs,Sandy Springs,GA,Fulton,Georgia,33.9366,-84.3703
213,California,Fresno County,CA,"Clovis, California, Fresno County","Clovis, California",Clovis,Clovis,CA,Fresno,California,36.8278,-119.683
214,Michigan,Genesee County,MI,"Flint, Michigan, Genesee County","Flint, Michigan",Flint,Flint,MI,Genesee,Michigan,43.0236,-83.6921
215,Virginia,Roanoke County,VA,"Roanoke, Virginia, Roanoke County","Roanoke, Virginia",Roanoke,Roanoke,VA,Roanoke,Virginia,37.2785,-79.9581
216,New York,Albany County,NY,"Albany, New York, Albany County","Albany, New York",Albany,Albany,NY,Albany,New York,42.6664,-73.7987
217,California,Riverside County,CA,"Jurupa Valley, California, Riverside County","Jurupa Valley, California",Jurupa Valley,Jurupa Valley,CA,Riverside,California,34.001,-117.4706
218,California,Los Angeles County,CA,"Compton, California, Los Angeles County","Compton, California",Compton,Compton,CA,Los Angeles,California,33.893,-118.2274
219,Oregon,Washington County,OR,"Hillsboro, Oregon, Washington County","Hillsboro, Oregon",Hillsboro,Hillsboro,OR,Washington,Oregon,45.5273,-122.936
220,Oklahoma,Comanche County,OK,"Lawton, Oklahoma, Comanche County","Lawton, Oklahoma",Lawton,Lawton,OK,Comanche,Oklahoma,34.6175,-98.4202
221,Washington,King County,WA,"Renton, Washington, King County","Renton, Washington",Renton,Renton,WA,King,Washington,47.4784,-122.1918
222,California,San Diego County,CA,"Vista, California, San Diego County","Vista, California",Vista,Vista,CA,San Diego,California,33.1896,-117.2386
223,Florida,Broward County,FL,"Davie, Florida, Broward County","Davie, Florida",Davie,Davie,FL,Broward,Florida,26.0789,-80.287
224,Colorado,Weld County,CO,"Greeley, Colorado, Weld County","Greeley, Colorado",Greeley,Greeley,CO,Weld,Colorado,40.4152,-104.7706
225,California,Orange County,CA,"Mission Viejo, California, Orange County","Mission Viejo, California",Mission Viejo,Mission Viejo,CA,Orange,California,33.6096,-117.6551
226,Michigan,Wayne County,MI,"Dearborn, Michigan, Wayne County","Dearborn, Michigan",Dearborn,Dearborn,MI,Wayne,Michigan,42.3127,-83.213
227,California,Los Angeles County,CA,"South Gate, California, Los Angeles County","South Gate, California",South Gate,South Gate,CA,Los Angeles,California,33.9447,-118.1926
228,Michigan,Wayne County,MI,"Livonia, Michigan, Wayne County","Livonia, Michigan",Livonia,Livonia,MI,Wayne,Michigan,42.3972,-83.3733
229,Massachusetts,Bristol County,MA,"New Bedford, Massachusetts, Bristol County","New Bedford, Massachusetts",New Bedford,New Bedford,MA,Bristol,Massachusetts,41.6697,-70.9428
230,California,Solano County,CA,"Vacaville, California, Solano County","Vacaville, California",Vacaville,Vacaville,CA,Solano,California,38.3587,-121.9673
231,Massachusetts,Plymouth County,MA,"Brockton, Massachusetts, Plymouth County","Brockton, Massachusetts",Brockton,Brockton,MA,Plymouth,Massachusetts,42.0821,-71.0242
232,Georgia,Fulton County,GA,"Roswell, Georgia, Fulton County","Roswell, Georgia",Roswell,Roswell,GA,Fulton,Georgia,34.0391,-84.3513
233,Oregon,Washington County,OR,"Beaverton, Oregon, Washington County","Beaverton, Oregon",Beaverton,Beaverton,OR,Washington,Oregon,45.4779,-122.8168
234,Massachusetts,Norfolk County,MA,"Quincy, Massachusetts, Norfolk County","Quincy, Massachusetts",Quincy,Quincy,MA,Norfolk,Massachusetts,42.2506,-71.0187
235,Nevada,Washoe County,NV,"Sparks, Nevada, Washoe County","Sparks, Nevada",Sparks,Sparks,NV,Washoe,Nevada,39.5736,-119.7161
236,Washington,Yakima County,WA,"Yakima, Washington, Yakima County","Yakima, Washington",Yakima,Yakima,WA,Yakima,Washington,46.5923,-120.5496
237,Washington,King County,WA,"Federal Way, Washington, King County","Federal Way, Washington",Federal Way,Federal Way,WA,King,Washington,47.3091,-122.3358
238,California,Los Angeles County,CA,"Carson, California, Los Angeles County","Carson, California",Carson,Carson,CA,Los Angeles,California,33.8374,-118.2559
239,California,Los Angeles County,CA,"Santa Monica, California, Los Angeles County","Santa Monica, California",Santa Monica,Santa Monica,CA,Los Angeles,California,34.0235,-118.481
240,California,San Bernardino County,CA,"Hesperia, California, San Bernardino County","Hesperia, California",Hesperia,Hesperia,CA,San Bernardino,California,34.3975,-117.3147
241,Texas,Collin County,TX,"Allen, Texas, Collin County","Allen, Texas",Allen,Allen,TX,Collin,Texas,33.1088,-96.6735
242,California,Orange County,CA,"Westminster, California, Orange County","Westminster, California",Westminster,Westminster,CA,Orange,California,33.7523,-117.9938
243,Utah,Utah County,UT,"Orem, Utah, Utah County","Orem, Utah",Orem,Orem,UT,Utah,Utah,40.2981,-111.6994
244,Massachusetts,Essex County,MA,"Lynn, Massachusetts, Essex County","Lynn, Massachusetts",Lynn,Lynn,MA,Essex,Massachusetts,42.4781,-70.9664
245,California,Shasta County,CA,"Redding, California, Shasta County","Redding, California",Redding,Redding,CA,Shasta,California,40.5698,-122.365
246,Washington,Spokane County,WA,"Spokane Valley, Washington, Spokane County","Spokane Valley, Washington",Spokane Valley,Spokane Valley,WA,Spokane,Washington,47.6626,-117.2346
247,Florida,Miami-Dade County,FL,"Miami Beach, Florida, Miami-Dade County","Miami Beach, Florida",Miami Beach,Miami Beach,FL,Miami-Dade,Florida,25.8171,-80.1396
248,Texas,Galveston County,TX,"League City, Texas, Galveston County","League City, Texas",League City,League City,TX,Galveston,Texas,29.4874,-95.1087
249,California,Santa Barbara County,CA,"Santa Barbara, California, Santa Barbara County","Santa Barbara, California",Santa Barbara,Santa Barbara,CA,Santa Barbara,California,34.4285,-119.7202
250,Florida,Broward County,FL,"Plantation, Florida, Broward County","Plantation, Florida",Plantation,Plantation,FL,Broward,Florida,26.1259,-80.2617
251,Utah,Salt Lake County,UT,"Sandy, Utah, Salt Lake County","Sandy, Utah",Sandy,Sandy,UT,Salt Lake,Utah,40.5709,-111.8506
252,Florida,Broward County,FL,"Sunrise, Florida, Broward County","Sunrise, Florida",Sunrise,Sunrise,FL,Broward,Florida,26.1547,-80.2997
253,Colorado,Boulder County,CO,"Longmont, Colorado, Boulder County","Longmont, Colorado",Longmont,Longmont,CO,Boulder,Colorado,40.1686,-105.1005
254,Florida,Palm Beach County,FL,"Boca Raton, Florida, Palm Beach County","Boca Raton, Florida",Boca Raton,Boca Raton,FL,Palm Beach,Florida,26.3752,-80.108
255,California,San Diego County,CA,"San Marcos, California, San Diego County","San Marcos, California",San Marcos,San Marcos,CA,San Diego,California,33.135,-117.1743
256,Massachusetts,Bristol County,MA,"Fall River, Massachusetts, Bristol County","Fall River, Massachusetts",Fall River,Fall River,MA,Bristol,Massachusetts,41.7136,-71.1015
257,Massachusetts,Middlesex County,MA,"Newton, Massachusetts, Middlesex County","Newton, Massachusetts",Newton,Newton,MA,Middlesex,Massachusetts,42.3316,-71.2085
258,California,Alameda County,CA,"San Leandro, California, Alameda County","San Leandro, California",San Leandro,San Leandro,CA,Alameda,California,37.7074,-122.1599
259,Arkansas,Sebastian County,AR,"Fort Smith, Arkansas, Sebastian County","Fort Smith, Arkansas",Fort Smith,Fort Smith,AR,Sebastian,Arkansas,35.3495,-94.3695
260,California,Orange County,CA,"Newport Beach, California, Orange County","Newport Beach, California",Newport Beach,Newport Beach,CA,Orange,California,33.6151,-117.8668
261,New Hampshire,Hillsborough County,NH,"Nashua, New Hampshire, Hillsborough County","Nashua, New Hampshire",Nashua,Nashua,NH,Hillsborough,New Hampshire,42.7491,-71.491
262,Oklahoma,Oklahoma County,OK,"Edmond, Oklahoma, Oklahoma County","Edmond, Oklahoma",Edmond,Edmond,OK,Oklahoma,Oklahoma,35.6689,-97.416
263,California,Los Angeles County,CA,"Whittier, California, Los Angeles County","Whittier, California",Whittier,Whittier,CA,Los Angeles,California,33.9678,-118.0188
264,Minnesota,Hennepin County,MN,"Bloomington, Minnesota, Hennepin County","Bloomington, Minnesota",Bloomington,Bloomington,MN,Hennepin,Minnesota,44.8306,-93.3151
265,California,Los Angeles County,CA,"Hawthorne, California, Los Angeles County","Hawthorne, California",Hawthorne,Hawthorne,CA,Los Angeles,California,33.9147,-118.3476
266,New Jersey,Passaic County,NJ,"Clifton, New Jersey, Passaic County","Clifton, New Jersey",Clifton,Clifton,NJ,Passaic,New Jersey,40.863,-74.1575
267,California,Sacramento County,CA,"Citrus Heights, California, Sacramento County","Citrus Heights, California",Citrus Heights,Citrus Heights,CA,Sacramento,California,38.6948,-121.288
268,California,Alameda County,CA,"Livermore, California, Alameda County","Livermore, California",Livermore,Livermore,CA,Alameda,California,37.6868,-121.7607
269,California,San Joaquin County,CA,"Tracy, California, San Joaquin County","Tracy, California",Tracy,Tracy,CA,San Joaquin,California,37.7269,-121.4523
270,California,Los Angeles County,CA,"Alhambra, California, Los Angeles County","Alhambra, California",Alhambra,Alhambra,CA,Los Angeles,California,34.084,-118.1355
271,Washington,King County,WA,"Kirkland, Washington, King County","Kirkland, Washington",Kirkland,Kirkland,WA,King,Washington,47.697,-122.2057
272,New Jersey,Mercer County,NJ,"Trenton, New Jersey, Mercer County","Trenton, New Jersey",Trenton,Trenton,NJ,Mercer,New Jersey,40.2237,-74.7641
273,Utah,Weber County,UT,"Ogden, Utah, Weber County","Ogden, Utah",Ogden,Ogden,UT,Weber,Utah,41.2279,-111.9682
274,Illinois,Cook County,IL,"Cicero, Illinois, Cook County","Cicero, Illinois",Cicero,Cicero,IL,Cook,Illinois,41.8445,-87.7593
275,Texas,Fort Bend County,TX,"Sugar Land, Texas, Fort Bend County","Sugar Land, Texas",Sugar Land,Sugar Land,TX,Fort Bend,Texas,29.5935,-95.6358
276,Connecticut,Fairfield County,CT,"Danbury, Connecticut, Fairfield County","Danbury, Connecticut",Danbury,Danbury,CT,Fairfield,Connecticut,41.4015,-73.4709
277,California,Riverside County,CA,"Indio, California, Riverside County","Indio, California",Indio,Indio,CA,Riverside,California,33.7346,-116.2346
278,North Carolina,Cabarrus County,NC,"Concord, North Carolina, Cabarrus County","Concord, North Carolina",Concord,Concord,NC,Cabarrus,North Carolina,35.3933,-80.6369
279,California,Riverside County,CA,"Menifee, California, Riverside County","Menifee, California",Menifee,Menifee,CA,Riverside,California,33.6909,-117.1849
280,Illinois,Champaign County,IL,"Champaign, Illinois, Champaign County","Champaign, Illinois",Champaign,Champaign,IL,Champaign,Illinois,40.1142,-88.2737
281,California,Orange County,CA,"Buena Park, California, Orange County","Buena Park, California",Buena Park,Buena Park,CA,Orange,California,33.8572,-118.0046
282,Michigan,Oakland County,MI,"Troy, Michigan, Oakland County","Troy, Michigan",Troy,Troy,MI,Oakland,Michigan,42.5817,-83.1457
283,Georgia,Fulton County,GA,"Johns Creek, Georgia, Fulton County","Johns Creek, Georgia",Johns Creek,Johns Creek,GA,Fulton,Georgia,34.0333,-84.2027
284,Washington,Whatcom County,WA,"Bellingham, Washington, Whatcom County","Bellingham, Washington",Bellingham,Bellingham,WA,Whatcom,Washington,48.7548,-122.469
285,Michigan,Wayne County,MI,"Westland, Michigan, Wayne County","Westland, Michigan",Westland,Westland,MI,Wayne,Michigan,42.3192,-83.3805
286,Iowa,Woodbury County,IA,"Sioux City, Iowa, Woodbury County","Sioux City, Iowa",Sioux City,Sioux City,IA,Woodbury,Iowa,42.4959,-96.3901
287,Rhode Island,Kent County,RI,"Warwick, Rhode Island, Kent County","Warwick, Rhode Island",Warwick,Warwick,RI,Kent,Rhode Island,41.7062,-71.4334
288,California,Riverside County,CA,"Hemet, California, Riverside County","Hemet, California",Hemet,Hemet,CA,Riverside,California,33.7341,-116.9969
289,Texas,Gregg County,TX,"Longview, Texas, Gregg County","Longview, Texas",Longview,Longview,TX,Gregg,Texas,32.5193,-94.7622
290,Michigan,Oakland County,MI,"Farmington Hills, Michigan, Oakland County","Farmington Hills, Michigan",Farmington Hills,Farmington Hills,MI,Oakland,Michigan,42.486,-83.3771
291,Oregon,Deschutes County,OR,"Bend, Oregon, Deschutes County","Bend, Oregon",Bend,Bend,OR,Deschutes,Oregon,44.0563,-121.3095
292,California,Los Angeles County,CA,"Lakewood, California, Los Angeles County","Lakewood, California",Lakewood,Lakewood,CA,Los Angeles,California,33.8471,-118.1222
293,California,San Bernardino County,CA,"Chino, California, San Bernardino County","Chino, California",Chino,Chino,CA,San Bernardino,California,33.9836,-117.6654
294,California,San Mateo County,CA,"Redwood City, California, San Mateo County","Redwood City, California",Redwood City,Redwood City,CA,San Mateo,California,37.5025,-122.2253
295,Rhode Island,Providence County,RI,"Cranston, Rhode Island, Providence County","Cranston, Rhode Island",Cranston,Cranston,RI,Providence,Rhode Island,41.7658,-71.4858
296,Ohio,Cuyahoga County,OH,"Parma, Ohio, Cuyahoga County","Parma, Ohio",Parma,Parma,OH,Cuyahoga,Ohio,41.3843,-81.7286
297,New York,Westchester County,NY,"New Rochelle, New York, Westchester County","New Rochelle, New York",New Rochelle,New Rochelle,NY,Westchester,New York,40.9304,-73.7836
298,California,Orange County,CA,"Lake Forest, California, Orange County","Lake Forest, California",Lake Forest,Lake Forest,CA,Orange,California,33.6605,-117.6714
299,California,Napa County,CA,"Napa, California, Napa County","Napa, California",Napa,Napa,CA,Napa,California,38.2975,-122.301
300,Indiana,Lake County,IN,"Hammond, Indiana, Lake County","Hammond, Indiana",Hammond,Hammond,IN,Lake,Indiana,41.6168,-87.4909
301,Arkansas,Washington County,AR,"Fayetteville, Arkansas, Washington County","Fayetteville, Arkansas",Fayetteville,Fayetteville,AR,Washington,Arkansas,36.0714,-94.1661
302,Illinois,McLean County,IL,"Bloomington, Illinois, McLean County","Bloomington, Illinois",Bloomington,Bloomington,IL,McLean,Illinois,40.4757,-88.9703
303,Arizona,Maricopa County,AZ,"Avondale, Arizona, Maricopa County","Avondale, Arizona",Avondale,Avondale,AZ,Maricopa,Arizona,33.3873,-112.3235
304,Florida,Pinellas County,FL,"Largo, Florida, Pinellas County","Largo, Florida",Largo,Largo,FL,Pinellas,Florida,27.9088,-82.7712
305,Minnesota,Hennepin County,MN,"Brooklyn Park, Minnesota, Hennepin County","Brooklyn Park, Minnesota",Brooklyn Park,Brooklyn Park,MN,Hennepin,Minnesota,45.1112,-93.3505
306,California,Orange County,CA,"Tustin, California, Orange County","Tustin, California",Tustin,Tustin,CA,Orange,California,33.7311,-117.8107
307,Florida,Broward County,FL,"Deerfield Beach, Florida, Broward County","Deerfield Beach, Florida",Deerfield Beach,Deerfield Beach,FL,Broward,Florida,26.305,-80.1277
308,California,Santa Clara County,CA,"Mountain View, California, Santa Clara County","Mountain View, California",Mountain View,Mountain View,CA,Santa Clara,California,37.4001,-122.0796
309,Oregon,Jackson County,OR,"Medford, Oregon, Jackson County","Medford, Oregon",Medford,Medford,OR,Jackson,Oregon,42.3372,-122.854
310,Massachusetts,Essex County,MA,"Lawrence, Massachusetts, Essex County","Lawrence, Massachusetts",Lawrence,Lawrence,MA,Essex,Massachusetts,42.7002,-71.1626
311,California,Los Angeles County,CA,"Bellflower, California, Los Angeles County","Bellflower, California",Bellflower,Bellflower,CA,Los Angeles,California,33.888,-118.1271
312,Florida,Brevard County,FL,"Melbourne, Florida, Brevard County","Melbourne, Florida",Melbourne,Melbourne,FL,Brevard,Florida,28.1086,-80.6627
313,California,Los Angeles County,CA,"Baldwin Park, California, Los Angeles County","Baldwin Park, California",Baldwin Park,Baldwin Park,CA,Los Angeles,California,34.0829,-117.9722
314,California,San Bernardino County,CA,"Chino Hills, California, San Bernardino County","Chino Hills, California",Chino Hills,Chino Hills,CA,San Bernardino,California,33.9508,-117.7254
315,California,Alameda County,CA,"Alameda, California, Alameda County","Alameda, California",Alameda,Alameda,CA,Alameda,California,37.7668,-122.267
316,Georgia,Dougherty County,GA,"Albany, Georgia, Dougherty County","Albany, Georgia",Albany,Albany,GA,Dougherty,Georgia,31.5776,-84.1762
317,Illinois,Cook County,IL,"Evanston, Illinois, Cook County","Evanston, Illinois",Evanston,Evanston,IL,Cook,Illinois,42.0464,-87.6943
318,Michigan,Kalamazoo County,MI,"Kalamazoo, Michigan, Kalamazoo County","Kalamazoo, Michigan",Kalamazoo,Kalamazoo,MI,Kalamazoo,Michigan,42.2749,-85.5882
319,California,San Bernardino County,CA,"Upland, California, San Bernardino County","Upland, California",Upland,Upland,CA,San Bernardino,California,34.1178,-117.6604
320,Arkansas,Washington County,AR,"Springdale, Arkansas, Washington County","Springdale, Arkansas",Springdale,Springdale,AR,Washington,Arkansas,36.1901,-94.1574
321,South Carolina,Charleston County,SC,"Mount Pleasant, South Carolina, Charleston County","Mount Pleasant, South Carolina",Mount Pleasant,Mount Pleasant,SC,Charleston,South Carolina,32.8537,-79.8203
322,Washington,King County,WA,"Auburn, Washington, King County","Auburn, Washington",Auburn,Auburn,WA,King,Washington,47.3039,-122.2108
323,California,Contra Costa County,CA,"San Ramon, California, Contra Costa County","San Ramon, California",San Ramon,San Ramon,CA,Contra Costa,California,37.7624,-121.9365
324,California,Alameda County,CA,"Pleasanton, California, Alameda County","Pleasanton, California",Pleasanton,Pleasanton,CA,Alameda,California,37.6663,-121.8805
325,Michigan,Kent County,MI,"Wyoming, Michigan, Kent County","Wyoming, Michigan",Wyoming,Wyoming,MI,Kent,Michigan,42.8908,-85.7066
326,Minnesota,Hennepin County,MN,"Plymouth, Minnesota, Hennepin County","Plymouth, Minnesota",Plymouth,Plymouth,MN,Hennepin,Minnesota,45.0225,-93.4617
327,North Carolina,Gaston County,NC,"Gastonia, North Carolina, Gaston County","Gastonia, North Carolina",Gastonia,Gastonia,NC,Gaston,North Carolina,35.2494,-81.1854
328,California,Sacramento County,CA,"Folsom, California, Sacramento County","Folsom, California",Folsom,Folsom,CA,Sacramento,California,38.6668,-121.1422
329,Michigan,Oakland County,MI,"Southfield, Michigan, Oakland County","Southfield, Michigan",Southfield,Southfield,MI,Oakland,Michigan,42.4765,-83.2605
330,Michigan,Oakland County,MI,"Rochester Hills, Michigan, Oakland County","Rochester Hills, Michigan",Rochester Hills,Rochester Hills,MI,Oakland,Michigan,42.6645,-83.1563
331,Connecticut,Hartford County,CT,"New Britain, Connecticut, Hartford County","New Britain, Connecticut",New Britain,New Britain,CT,Hartford,Connecticut,41.6759,-72.7862
332,Arizona,Maricopa County,AZ,"Goodyear, Arizona, Maricopa County","Goodyear, Arizona",Goodyear,Goodyear,AZ,Maricopa,Arizona,33.2614,-112.3622
333,Ohio,Stark County,OH,"Canton, Ohio, Stark County","Canton, Ohio",Canton,Canton,OH,Stark,Ohio,40.8078,-81.3676
334,Georgia,Houston County,GA,"Warner Robins, Georgia, Houston County","Warner Robins, Georgia",Warner Robins,Warner Robins,GA,Houston,Georgia,32.5961,-83.6527
335,California,Alameda County,CA,"Union City, California, Alameda County","Union City, California",Union City,Union City,CA,Alameda,California,37.6032,-122.0181
336,California,Riverside County,CA,"Perris, California, Riverside County","Perris, California",Perris,Perris,CA,Riverside,California,33.7898,-117.2233
337,California,San Joaquin County,CA,"Manteca, California, San Joaquin County","Manteca, California",Manteca,Manteca,CA,San Joaquin,California,37.7927,-121.2264
338,Arkansas,Craighead County,AR,"Jonesboro, Arkansas, Craighead County","Jonesboro, Arkansas",Jonesboro,Jonesboro,AR,Craighead,Arkansas,35.8212,-90.6791
339,Delaware,New Castle County,DE,"Wilmington, Delaware, New Castle County","Wilmington, Delaware",Wilmington,Wilmington,DE,New Castle,Delaware,39.7415,-75.5416
