city_id,State,County,State Abbreviation,city_name_id,city_state,city,City,state_id,county_name,state_name,lat,lng
507,California,Santa Clara County,CA,"Gilroy, California, Santa Clara County","Gilroy, California",Gilroy,Gilroy,CA,Santa Clara,California,37.0046,-121.5854
508,Oregon,Linn County,OR,"Albany, Oregon, Linn County","Albany, Oregon",Albany,Albany,OR,Linn,Oregon,44.6272,-123.0965
509,Iowa,Polk County,IA,"Ankeny, Iowa, Polk County","Ankeny, Iowa",Ankeny,Ankeny,IA,Polk,Iowa,41.7288,-93.6031
510,North Carolina,Alamance County,NC,"Burlington, North Carolina, Alamance County","Burlington, North Carolina",Burlington,Burlington,NC,Alamance,North Carolina,36.076,-79.4685
511,Minnesota,Hennepin County,MN,"Minnetonka, Minnesota, Hennepin County","Minnetonka, Minnesota",Minnetonka,Minnetonka,MN,Hennepin,Minnesota,44.9322,-93.4598
512,Ohio,Cuyahoga County,OH,"Lakewood, Ohio, Cuyahoga County","Lakewood, Ohio",Lakewood,Lakewood,OH,Cuyahoga,Ohio,41.4822,-81.8008
513,California,Los Angeles County,CA,"Glendora, California, Los Angeles County","Glendora, California",Glendora,Glendora,CA,Los Angeles,California,34.1449,-117.8467
514,West Virginia,Kanawha County,WV,"Charleston, West Virginia, Kanawha County","Charleston, West Virginia",Charleston,Charleston,WV,Kanawha,West Virginia,38.3484,-81.6322
515,Oklahoma,Garfield County,OK,"Enid, Oklahoma, Garfield County","Enid, Oklahoma",Enid,Enid,OK,Garfield,Oklahoma,36.4063,-97.87
516,Florida,Palm Beach County,FL,"Palm Beach Gardens, Florida, Palm Beach County","Palm Beach Gardens, Florida",Palm Beach Gardens,Palm Beach Gardens,FL,Palm Beach,Florida,26.8466,-80.1679
517,New Jersey,Union County,NJ,"Plainfield, New Jersey, Union County","Plainfield, New Jersey",Plainfield,Plainfield,NJ,Union,New Jersey,40.6154,-74.4157
518,California,Riverside County,CA,"Palm Desert, California, Riverside County","Palm Desert, California",Palm Desert,Palm Desert,CA,Riverside,California,33.7378,-116.3695
519,North Carolina,Mecklenburg County,NC,"Huntersville, North Carolina, Mecklenburg County","Huntersville, North Carolina",Huntersville,Huntersville,NC,Mecklenburg,North Carolina,35.406,-80.8716
520,Oregon,Washington County,OR,"Tigard, Oregon, Washington County","Tigard, Oregon",Tigard,Tigard,OR,Washington,Oregon,45.4237,-122.7845
521,Michigan,Saginaw County,MI,"Saginaw, Michigan, Saginaw County","Saginaw, Michigan",Saginaw,Saginaw,MI,Saginaw,Michigan,43.4199,-83.9501
522,Michigan,Kent County,MI,"Kentwood, Michigan, Kent County","Kentwood, Michigan",Kentwood,Kentwood,MI,Kent,Michigan,42.8852,-85.5926
523,Florida,Miami-Dade County,FL,"Doral, Florida, Miami-Dade County","Doral, Florida",Doral,Doral,FL,Miami-Dade,Florida,25.8152,-80.3565
524,Minnesota,Dakota County,MN,"Apple Valley, Minnesota, Dakota County","Apple Valley, Minnesota",Apple Valley,Apple Valley,MN,Dakota,Minnesota,44.7457,-93.2004
525,Texas,Tarrant County,TX,"Grapevine, Texas, Tarrant County","Grapevine, Texas",Grapevine,Grapevine,TX,Tarrant,Texas,32.9343,-97.0742
526,California,Orange County,CA,"Aliso Viejo, California, Orange County","Aliso Viejo, California",Aliso Viejo,Aliso Viejo,CA,Orange,California,33.5792,-117.7289
527,Washington,King County,WA,"Sammamish, Washington, King County","Sammamish, Washington",Sammamish,Sammamish,WA,King,Washington,47.6017,-122.0416
528,Arizona,Pinal County,AZ,"Casa Grande, Arizona, Pinal County","Casa Grande, Arizona",Casa Grande,Casa Grande,AZ,Pinal,Arizona,32.9069,-111.7624
529,Florida,Pinellas County,FL,"Pinellas Park, Florida, Pinellas County","Pinellas Park, Florida",Pinellas Park,Pinellas Park,FL,Pinellas,Florida,27.8589,-82.7078
530,New York,Rensselaer County,NY,"Troy, New York, Rensselaer County","Troy, New York",Troy,Troy,NY,Rensselaer,New York,42.7354,-73.6751
531,California,Yolo County,CA,"West Sacramento, California, Yolo County","West Sacramento, California",West Sacramento,West Sacramento,CA,Yolo,California,38.5557,-121.5505
532,Washington,King County,WA,"Burien, Washington, King County","Burien, Washington",Burien,Burien,WA,King,Washington,47.4762,-122.3394
533,Colorado,Adams County,CO,"Commerce City, Colorado, Adams County","Commerce City, Colorado",Commerce City,Commerce City,CO,Adams,Colorado,39.8641,-104.843
534,California,Los Angeles County,CA,"Cerritos, California, Los Angeles County","Cerritos, California",Cerritos,Cerritos,CA,Los Angeles,California,33.8678,-118.0686
535,Florida,Miami-Dade County,FL,"Coral Gables, Florida, Miami-Dade County","Coral Gables, Florida",Coral Gables,Coral Gables,FL,Miami-Dade,Florida,25.7037,-80.2715
536,New York,Niagara County,NY,"Niagara Falls, New York, Niagara County","Niagara Falls, New York",Niagara Falls,Niagara Falls,NY,Niagara,New York,43.0921,-79.0147
537,California,San Diego County,CA,"Poway, California, San Diego County","Poway, California",Poway,Poway,CA,San Diego,California,32.9871,-117.0201
538,Minnesota,Hennepin County,MN,"Edina, Minnesota, Hennepin County","Edina, Minnesota",Edina,Edina,MN,Hennepin,Minnesota,44.8914,-93.3602
539,Ohio,Summit County,OH,"Cuyahoga Falls, Ohio, Summit County","Cuyahoga Falls, Ohio",Cuyahoga Falls,Cuyahoga Falls,OH,Summit,Ohio,41.1641,-81.5207
540,California,Orange County,CA,"Rancho Santa Margarita, California, Orange County","Rancho Santa Margarita, California",Rancho Santa Margarita,Rancho Santa Margarita,CA,Orange,California,33.6318,-117.5988
541,Pennsylvania,Dauphin County,PA,"Harrisburg, Pennsylvania, Dauphin County","Harrisburg, Pennsylvania",Harrisburg,Harrisburg,PA,Dauphin,Pennsylvania,40.2752,-76.8843
542,West Virginia,Cabell County,WV,"Huntington, West Virginia, Cabell County","Huntington, West Virginia",Huntington,Huntington,WV,Cabell,West Virginia,38.4109,-82.4345
543,California,Los Angeles County,CA,"La Mirada, California, Los Angeles County","La Mirada, California",La Mirada,La Mirada,CA,Los Angeles,California,33.9025,-118.0093
544,California,Orange County,CA,"Cypress, California, Orange County","Cypress, California",Cypress,Cypress,CA,Orange,California,33.8171,-118.0386
545,Ohio,Butler County,OH,"Middletown, Ohio, Butler County","Middletown, Ohio",Middletown,Middletown,OH,Butler,Ohio,39.5033,-84.3659
546,Utah,Salt Lake County,UT,"Murray, Utah, Salt Lake County","Murray, Utah",Murray,Murray,UT,Salt Lake,Utah,40.6498,-111.8874
547,Colorado,Douglas County,CO,"Parker, Colorado, Douglas County","Parker, Colorado",Parker,Parker,CO,Douglas,Colorado,39.5084,-104.7753
548,Texas,Tarrant County,TX,"Bedford, Texas, Tarrant County","Bedford, Texas",Bedford,Bedford,TX,Tarrant,Texas,32.8464,-97.135
549,Michigan,Ingham County,MI,"East Lansing, Michigan, Ingham County","East Lansing, Michigan",East Lansing,East Lansing,MI,Ingham,Michigan,42.748,-84.4836
550,California,Los Angeles County,CA,"Covina, California, Los Angeles County","Covina, California",Covina,Covina,CA,Los Angeles,California,34.0903,-117.8818
551,Washington,Thurston County,WA,"Olympia, Washington, Thurston County","Olympia, Washington",Olympia,Olympia,WA,Thurston,Washington,47.0417,-122.8959
552,Ohio,Cuyahoga County,OH,"Euclid, Ohio, Cuyahoga County","Euclid, Ohio",Euclid,Euclid,OH,Cuyahoga,Ohio,41.5903,-81.5188
553,California,Los Angeles County,CA,"Azusa, California, Los Angeles County","Azusa, California",Azusa,Azusa,CA,Los Angeles,California,34.1386,-117.9124
554,Ohio,Licking County,OH,"Newark, Ohio, Licking County","Newark, Ohio",Newark,Newark,OH,Licking,Ohio,40.0706,-82.425
555,Virginia,Loudoun County,VA,"Leesburg, Virginia, Loudoun County","Leesburg, Virginia",Leesburg,Leesburg,VA,Loudoun,Virginia,39.1057,-77.5544
556,Michigan,Macomb County,MI,"Roseville, Michigan, Macomb County","Roseville, Michigan",Roseville,Roseville,MI,Macomb,Michigan,42.5074,-82.9369
557,Michigan,Kalamazoo County,MI,"Portage, Michigan, Kalamazoo County","Portage, Michigan",Portage,Portage,MI,Kalamazoo,Michigan,42.2,-85.5906
558,Connecticut,Middlesex County,CT,"Middletown, Connecticut, Middlesex County","Middletown, Connecticut",Middletown,Middletown,CT,Middlesex,Connecticut,41.5476,-72.6549
559,Tennessee,Shelby County,TN,"Collierville, Tennessee, Shelby County","Collierville, Tennessee",Collierville,Collierville,TN,Shelby,Tennessee,35.047,-89.6987
560,Oklahoma,Payne County,OK,"Stillwater, Oklahoma, Payne County","Stillwater, Oklahoma",Stillwater,Stillwater,OK,Payne,Oklahoma,36.1317,-97.0742
561,Rhode Island,Providence County,RI,"East Providence, Rhode Island, Providence County","East Providence, Rhode Island",East Providence,East Providence,RI,Providence,Rhode Island,41.8065,-71.3565
562,Wisconsin,Milwaukee County,WI,"Wauwatosa, Wisconsin, Milwaukee County","Wauwatosa, Wisconsin",Wauwatosa,Wauwatosa,WI,Milwaukee,Wisconsin,43.0616,-88.0347
563,Ohio,Lake County,OH,"Mentor, Ohio, Lake County","Mentor, Ohio",Mentor,Mentor,OH,Lake,Ohio,41.6893,-81.3362
564,California,Stanislaus County,CA,"Ceres, California, Stanislaus County","Ceres, California",Ceres,Ceres,CA,Stanislaus,California,37.5952,-120.962
565,Texas,Dallas County,TX,"Cedar Hill, Texas, Dallas County","Cedar Hill, Texas",Cedar Hill,Cedar Hill,TX,Dallas,Texas,32.581,-96.9591
566,Ohio,Richland County,OH,"Mansfield, Ohio, Richland County","Mansfield, Ohio",Mansfield,Mansfield,OH,Richland,Ohio,40.7656,-82.5275
567,California,San Luis Obispo County,CA,"San Luis Obispo, California, San Luis Obispo County","San Luis Obispo, California",San Luis Obispo,San Luis Obispo,CA,San Luis Obispo,California,35.2669,-120.669
568,California,Riverside County,CA,"Palm Springs, California, Riverside County","Palm Springs, California",Palm Springs,Palm Springs,CA,Riverside,California,33.8017,-116.5382
569,Arkansas,Jefferson County,AR,"Pine Bluff, Arkansas, Jefferson County","Pine Bluff, Arkansas",Pine Bluff,Pine Bluff,AR,Jefferson,Arkansas,34.2116,-92.0173
570,California,Riverside County,CA,"San Jacinto, California, Riverside County","San Jacinto, California",San Jacinto,San Jacinto,CA,Riverside,California,33.797,-116.9916
571,Ohio,Greene County,OH,"Beavercreek, Ohio, Greene County","Beavercreek, Ohio",Beavercreek,Beavercreek,OH,Greene,Ohio,39.731,-84.0624
572,Florida,Orange County,FL,"Apopka, Florida, Orange County","Apopka, Florida",Apopka,Apopka,FL,Orange,Florida,28.7015,-81.5316
573,Ohio,Cuyahoga County,OH,"Cleveland Heights, Ohio, Cuyahoga County","Cleveland Heights, Ohio",Cleveland Heights,Cleveland Heights,OH,Cuyahoga,Ohio,41.5113,-81.5636
574,Utah,Salt Lake County,UT,"Draper, Utah, Salt Lake County","Draper, Utah",Draper,Draper,UT,Salt Lake,Utah,40.4957,-111.8605
575,California,Placer County,CA,"Lincoln, California, Placer County","Lincoln, California",Lincoln,Lincoln,CA,Placer,California,38.8774,-121.2937
576,Washington,Thurston County,WA,"Lacey, Washington, Thurston County","Lacey, Washington",Lacey,Lacey,WA,Thurston,Washington,47.0462,-122.7933
577,Ohio,Cuyahoga County,OH,"Strongsville, Ohio, Cuyahoga County","Strongsville, Ohio",Strongsville,Strongsville,OH,Cuyahoga,Ohio,41.3128,-81.8313
578,Texas,Collin County,TX,"Wylie, Texas, Collin County","Wylie, Texas",Wylie,Wylie,TX,Collin,Texas,33.0362,-96.5161
579,New Jersey,Middlesex County,NJ,"Sayreville, New Jersey, Middlesex County","Sayreville, New Jersey",Sayreville,Sayreville,NJ,Middlesex,New Jersey,40.4656,-74.3237
580,North Carolina,Cabarrus County,NC,"Kannapolis, North Carolina, Cabarrus County","Kannapolis, North Carolina",Kannapolis,Kannapolis,NC,Cabarrus,North Carolina,35.4764,-80.6408
581,Florida,Brevard County,FL,"Titusville, Florida, Brevard County","Titusville, Florida",Titusville,Titusville,FL,Brevard,Florida,28.5727,-80.8193
582,New Jersey,Bergen County,NJ,"Hackensack, New Jersey, Bergen County","Hackensack, New Jersey",Hackensack,Hackensack,NJ,Bergen,New Jersey,40.8891,-74.0462
583,California,Alameda County,CA,"Newark, California, Alameda County","Newark, California",Newark,Newark,CA,Alameda,California,37.5201,-122.0307
584,Massachusetts,Berkshire County,MA,"Pittsfield, Massachusetts, Berkshire County","Pittsfield, Massachusetts",Pittsfield,Pittsfield,MA,Berkshire,Massachusetts,42.4517,-73.2605
585,Massachusetts,Bristol County,MA,"Attleboro, Massachusetts, Bristol County","Attleboro, Massachusetts",Attleboro,Attleboro,MA,Bristol,Massachusetts,41.9311,-71.295
586,Virginia,Montgomery County,VA,"Blacksburg, Virginia, Montgomery County","Blacksburg, Virginia",Blacksburg,Blacksburg,VA,Montgomery,Virginia,37.23,-80.4279
587,Ohio,Franklin County,OH,"Dublin, Ohio, Franklin County","Dublin, Ohio",Dublin,Dublin,OH,Franklin,Ohio,40.1112,-83.1454
588,Texas,Tarrant County,TX,"Haltom City, Texas, Tarrant County","Haltom City, Texas",Haltom City,Haltom City,TX,Tarrant,Texas,32.8176,-97.2707
589,California,Santa Barbara County,CA,"Lompoc, California, Santa Barbara County","Lompoc, California",Lompoc,Lompoc,CA,Santa Barbara,California,34.6618,-120.4714
590,California,Contra Costa County,CA,"Danville, California, Contra Costa County","Danville, California",Danville,Danville,CA,Contra Costa,California,37.8121,-121.9698
591,Florida,Miami-Dade County,FL,"Cutler Bay, Florida, Miami-Dade County","Cutler Bay, Florida",Cutler Bay,Cutler Bay,FL,Miami-Dade,Florida,25.5765,-80.3356
592,Florida,Broward County,FL,"Oakland Park, Florida, Broward County","Oakland Park, Florida",Oakland Park,Oakland Park,FL,Broward,Florida,26.178,-80.1528
593,Florida,Miami-Dade County,FL,"North Miami Beach, Florida, Miami-Dade County","North Miami Beach, Florida",North Miami Beach,North Miami Beach,FL,Miami-Dade,Florida,25.9302,-80.1659
594,California,Riverside County,CA,"Coachella, California, Riverside County","Coachella, California",Coachella,Coachella,CA,Riverside,California,33.6905,-116.143
595,Tennessee,Rutherford County,TN,"Smyrna, Tennessee, Rutherford County","Smyrna, Tennessee",Smyrna,Smyrna,TN,Rutherford,Tennessee,35.9687,-86.5264
596,Utah,Davis County,UT,"Bountiful, Utah, Davis County","Bountiful, Utah",Bountiful,Bountiful,UT,Davis,Utah,40.8721,-111.8647
597,Massachusetts,Middlesex County,MA,"Everett, Massachusetts, Middlesex County","Everett, Massachusetts",Everett,Everett,MA,Middlesex,Massachusetts,42.4064,-71.0545
598,Texas,Tarrant County,TX,"Keller, Texas, Tarrant County","Keller, Texas",Keller,Keller,TX,Tarrant,Texas,32.9335,-97.2256
599,California,Los Angeles County,CA,"Bell Gardens, California, Los Angeles County","Bell Gardens, California",Bell Gardens,Bell Gardens,CA,Los Angeles,California,33.9663,-118.155
600,Tennessee,Bradley County,TN,"Cleveland, Tennessee, Bradley County","Cleveland, Tennessee",Cleveland,Cleveland,TN,Bradley,Tennessee,35.1817,-84.8707
601,Florida,Broward County,FL,"North Lauderdale, Florida, Broward County","North Lauderdale, Florida",North Lauderdale,North Lauderdale,FL,Broward,Florida,26.2113,-80.2209
602,Massachusetts,Essex County,MA,"Salem, Massachusetts, Essex County","Salem, Massachusetts",Salem,Salem,MA,Essex,Massachusetts,42.5129,-70.9021
603,California,Los Angeles County,CA,"Rancho Palos Verdes, California, Los Angeles County","Rancho Palos Verdes, California",Rancho Palos Verdes,Rancho Palos Verdes,CA,Los Angeles,California,33.7554,-118.3634
604,California,San Mateo County,CA,"San Bruno, California, San Mateo County","San Bruno, California",San Bruno,San Bruno,CA,San Mateo,California,37.6256,-122.4313
605,New Hampshire,Merrimack County,NH,"Concord, New Hampshire, Merrimack County","Concord, New Hampshire",Concord,Concord,NH,Merrimack,New Hampshire,43.2305,-71.5595
606,Vermont,Chittenden County,VT,"Burlington, Vermont, Chittenden County","Burlington, Vermont",Burlington,Burlington,VT,Chittenden,Vermont,44.4876,-73.2316
607,North Carolina,Wake County,NC,"Apex, North Carolina, Wake County","Apex, North Carolina",Apex,Apex,NC,Wake,North Carolina,35.7237,-78.8743
608,Michigan,Midland County,MI,"Midland, Michigan, Midland County","Midland, Michigan",Midland,Midland,MI,Midland,Michigan,43.6241,-84.2319
609,Florida,Seminole County,FL,"Altamonte Springs, Florida, Seminole County","Altamonte Springs, Florida",Altamonte Springs,Altamonte Springs,FL,Seminole,Florida,28.6615,-81.3953
610,Iowa,Polk County,IA,"Urbandale, Iowa, Polk County","Urbandale, Iowa",Urbandale,Urbandale,IA,Polk,Iowa,41.639,-93.7812
611,Illinois,Champaign County,IL,"Urbana, Illinois, Champaign County","Urbana, Illinois",Urbana,Urbana,IL,Champaign,Illinois,40.1107,-88.1973
612,New Jersey,Hudson County,NJ,"Kearny, New Jersey, Hudson County","Kearny, New Jersey",Kearny,Kearny,NJ,Hudson,New Jersey,40.7528,-74.1202
613,Arizona,Pima County,AZ,"Oro Valley, Arizona, Pima County","Oro Valley, Arizona",Oro Valley,Oro Valley,AZ,Pima,Arizona,32.4208,-110.9767
614,Ohio,Hancock County,OH,"Findlay, Ohio, Hancock County","Findlay, Ohio",Findlay,Findlay,OH,Hancock,Ohio,41.0469,-83.6379
615,California,Sonoma County,CA,"Rohnert Park, California, Sonoma County","Rohnert Park, California",Rohnert Park,Rohnert Park,CA,Sonoma,California,38.3479,-122.6965
616,New Jersey,Union County,NJ,"Linden, New Jersey, Union County","Linden, New Jersey",Linden,Linden,NJ,Union,New Jersey,40.6251,-74.2383
617,Massachusetts,Hampden County,MA,"Westfield, Massachusetts, Hampden County","Westfield, Massachusetts",Westfield,Westfield,MA,Hampden,Massachusetts,42.1382,-72.7561
618,South Carolina,Sumter County,SC,"Sumter, South Carolina, Sumter County","Sumter, South Carolina",Sumter,Sumter,SC,Sumter,South Carolina,33.9392,-80.393
619,Rhode Island,Providence County,RI,"Woonsocket, Rhode Island, Providence County","Woonsocket, Rhode Island",Woonsocket,Woonsocket,RI,Providence,Rhode Island,42.001,-71.4993
620,Massachusetts,Worcester County,MA,"Leominster, Massachusetts, Worcester County","Leominster, Massachusetts",Leominster,Leominster,MA,Worcester,Massachusetts,42.5209,-71.7717
621,Connecticut,Fairfield County,CT,"Shelton, Connecticut, Fairfield County","Shelton, Connecticut",Shelton,Shelton,CT,Fairfield,Connecticut,41.306,-73.1383
622,California,Orange County,CA,"Brea, California, Orange County","Brea, California",Brea,Brea,CA,Orange,California,33.9254,-117.8655
623,Kentucky,Kenton County,KY,"Covington, Kentucky, Kenton County","Covington, Kentucky",Covington,Covington,KY,Kenton,Kentucky,39.0334,-84.5166
624,Utah,Salt Lake County,UT,"Riverton, Utah, Salt Lake County","Riverton, Utah",Riverton,Riverton,UT,Salt Lake,Utah,40.5176,-111.9636
625,California,Santa Clara County,CA,"Morgan Hill, California, Santa Clara County","Morgan Hill, California",Morgan Hill,Morgan Hill,CA,Santa Clara,California,37.1325,-121.6419
626,Ohio,Trumbull County,OH,"Warren, Ohio, Trumbull County","Warren, Ohio",Warren,Warren,OH,Trumbull,Ohio,41.239,-80.8174
627,Washington,Snohomish County,WA,"Edmonds, Washington, Snohomish County","Edmonds, Washington",Edmonds,Edmonds,WA,Snohomish,Washington,47.8115,-122.3533
628,Texas,Johnson County,TX,"Burleson, Texas, Johnson County","Burleson, Texas",Burleson,Burleson,TX,Johnson,Texas,32.517,-97.3344
629,Massachusetts,Essex County,MA,"Beverly, Massachusetts, Essex County","Beverly, Massachusetts",Beverly,Beverly,MA,Essex,Massachusetts,42.5681,-70.8627
630,Maryland,Washington County,MD,"Hagerstown, Maryland, Washington County","Hagerstown, Maryland",Hagerstown,Hagerstown,MD,Washington,Maryland,39.6401,-77.7217
631,Arizona,Yavapai County,AZ,"Prescott, Arizona, Yavapai County","Prescott, Arizona",Prescott,Prescott,AZ,Yavapai,Arizona,34.5849,-112.4473
632,California,Santa Clara County,CA,"Campbell, California, Santa Clara County","Campbell, California",Campbell,Campbell,CA,Santa Clara,California,37.2802,-121.9539
633,California,Riverside County,CA,"Beaumont, California, Riverside County","Beaumont, California",Beaumont,Beaumont,CA,Riverside,California,33.9076,-116.9766
634,California,Los Angeles County,CA,"La Puente, California, Los Angeles County","La Puente, California",La Puente,La Puente,CA,Los Angeles,California,34.0323,-117.9533
635,Massachusetts,Worcester County,MA,"Fitchburg, Massachusetts, Worcester County","Fitchburg, Massachusetts",Fitchburg,Fitchburg,MA,Worcester,Massachusetts,42.5912,-71.8156
636,North Carolina,Catawba County,NC,"Hickory, North Carolina, Catawba County","Hickory, North Carolina",Hickory,Hickory,NC,Catawba,North Carolina,35.741,-81.3223
637,Connecticut,New London County,CT,"Norwich, Connecticut, New London County","Norwich, Connecticut",Norwich,Norwich,CT,New London,Connecticut,41.5495,-72.0882
638,Texas,Dallas County,TX,"Coppell, Texas, Dallas County","Coppell, Texas",Coppell,Coppell,TX,Dallas,Texas,32.9639,-96.9903
639,California,Los Angeles County,CA,"San Gabriel, California, Los Angeles County","San Gabriel, California",San Gabriel,San Gabriel,CA,Los Angeles,California,34.0949,-118.099
640,Massachusetts,Hampden County,MA,"Holyoke, Massachusetts, Hampden County","Holyoke, Massachusetts",Holyoke,Holyoke,MA,Hampden,Massachusetts,42.2125,-72.6411
641,Arkansas,Benton County,AR,"Bentonville, Arkansas, Benton County","Bentonville, Arkansas",Bentonville,Bentonville,AR,Benton,Arkansas,36.3547,-94.2305
642,Tennessee,Williamson County,TN,"Brentwood, Tennessee, Williamson County","Brentwood, Tennessee",Brentwood,Brentwood,TN,Williamson,Tennessee,35.9918,-86.7758
643,Wisconsin,Waukesha County,WI,"New Berlin, Wisconsin, Waukesha County","New Berlin, Wisconsin",New Berlin,New Berlin,WI,Waukesha,Wisconsin,42.9726,-88.1291
644,South Carolina,Berkeley County,SC,"Goose Creek, South Carolina, Berkeley County","Goose Creek, South Carolina",Goose Creek,Goose Creek,SC,Berkeley,South Carolina,32.9927,-80.0055
645,Arizona,Yavapai County,AZ,"Prescott Valley, Arizona, Yavapai County","Prescott Valley, Arizona",Prescott Valley,Prescott Valley,AZ,Yavapai,Arizona,34.598,-112.3185
646,Minnesota,Ramsey County,MN,"Maplewood, Minnesota, Ramsey County","Maplewood, Minnesota",Maplewood,Maplewood,MN,Ramsey,Minnesota,44.9842,-93.0247
647,Texas,Dallas County,TX,"Duncanville, Texas, Dallas County","Duncanville, Texas",Duncanville,Duncanville,TX,Dallas,Texas,32.646,-96.9127
648,New Jersey,Atlantic County,NJ,"Atlantic City, New Jersey, Atlantic County","Atlantic City, New Jersey",Atlantic City,Atlantic City,NJ,Atlantic,New Jersey,39.3797,-74.4527
649,Texas,Denton County,TX,"The Colony, Texas, Denton County","The Colony, Texas",The Colony,The Colony,TX,Denton,Texas,33.0925,-96.8976
650,California,Los Angeles County,CA,"Culver City, California, Los Angeles County","Culver City, California",Culver City,Culver City,CA,Los Angeles,California,34.0058,-118.3968
651,Massachusetts,Middlesex County,MA,"Marlborough, Massachusetts, Middlesex County","Marlborough, Massachusetts",Marlborough,Marlborough,MA,Middlesex,Massachusetts,42.3494,-71.5468
652,Arizona,Mohave County,AZ,"Bullhead City, Arizona, Mohave County","Bullhead City, Arizona",Bullhead City,Bullhead City,AZ,Mohave,Arizona,35.1205,-114.5461
653,Tennessee,Shelby County,TN,"Germantown, Tennessee, Shelby County","Germantown, Tennessee",Germantown,Germantown,TN,Shelby,Tennessee,35.0829,-89.7824
654,California,Riverside County,CA,"La Quinta, California, Riverside County","La Quinta, California",La Quinta,La Quinta,CA,Riverside,California,33.6536,-116.2785
655,Ohio,Fairfield County,OH,"Lancaster, Ohio, Fairfield County","Lancaster, Ohio",Lancaster,Lancaster,OH,Fairfield,Ohio,39.7248,-82.6049
656,Florida,Orange County,FL,"Ocoee, Florida, Orange County","Ocoee, Florida",Ocoee,Ocoee,FL,Orange,Florida,28.5796,-81.5332
657,Minnesota,Scott County,MN,"Shakopee, Minnesota, Scott County","Shakopee, Minnesota",Shakopee,Shakopee,MN,Scott,Minnesota,44.7745,-93.4772
658,Massachusetts,Middlesex County,MA,"Woburn, Massachusetts, Middlesex County","Woburn, Massachusetts",Woburn,Woburn,MA,Middlesex,Massachusetts,42.4869,-71.1543
659,Washington,Kitsap County,WA,"Bremerton, Washington, Kitsap County","Bremerton, Washington",Bremerton,Bremerton,WA,Kitsap,Washington,47.5436,-122.7121
660,Oklahoma,Muskogee County,OK,"Muskogee, Oklahoma, Muskogee County","Muskogee, Oklahoma",Muskogee,Muskogee,OK,Muskogee,Oklahoma,35.7432,-95.3567
661,Florida,Volusia County,FL,"Ormond Beach, Florida, Volusia County","Ormond Beach, Florida",Ormond Beach,Ormond Beach,FL,Volusia,Florida,29.2985,-81.1014
662,California,Orange County,CA,"Stanton, California, Orange County","Stanton, California",Stanton,Stanton,CA,Orange,California,33.8003,-117.9935
663,Washington,Pierce County,WA,"Puyallup, Washington, Pierce County","Puyallup, Washington",Puyallup,Puyallup,WA,Pierce,Washington,47.1793,-122.2902
664,California,San Mateo County,CA,"Pacifica, California, San Mateo County","Pacifica, California",Pacifica,Pacifica,CA,San Mateo,California,37.6113,-122.4782
665,Texas,Tarrant County,TX,"Hurst, Texas, Tarrant County","Hurst, Texas",Hurst,Hurst,TX,Tarrant,Texas,32.8353,-97.1809
666,Ohio,Allen County,OH,"Lima, Ohio, Allen County","Lima, Ohio",Lima,Lima,OH,Allen,Ohio,40.741,-84.112
667,Arizona,Pima County,AZ,"Marana, Arizona, Pima County","Marana, Arizona",Marana,Marana,AZ,Pima,Arizona,32.4355,-111.1558
668,California,Contra Costa County,CA,"Oakley, California, Contra Costa County","Oakley, California",Oakley,Oakley,CA,Contra Costa,California,37.9929,-121.6952
669,Ohio,Montgomery County,OH,"Huber Heights, Ohio, Montgomery County","Huber Heights, Ohio",Huber Heights,Huber Heights,OH,Montgomery,Ohio,39.8595,-84.113
670,Texas,Dallas County,TX,"Lancaster, Texas, Dallas County","Lancaster, Texas",Lancaster,Lancaster,TX,Dallas,Texas,32.5922,-96.7739
671,California,San Bernardino County,CA,"Montclair, California, San Bernardino County","Montclair, California",Montclair,Montclair,CA,San Bernardino,California,34.0715,-117.6981
672,Illinois,Cook County,IL,"Wheeling, Illinois, Cook County","Wheeling, Illinois",Wheeling,Wheeling,IL,Cook,Illinois,42.1308,-87.924
673,Wisconsin,Waukesha County,WI,"Brookfield, Wisconsin, Waukesha County","Brookfield, Wisconsin",Brookfield,Brookfield,WI,Waukesha,Wisconsin,43.064,-88.1231
674,Utah,Weber County,UT,"Roy, Utah, Weber County","Roy, Utah",Roy,Roy,UT,Weber,Utah,41.1714,-112.0485
675,Florida,Orange County,FL,"Winter Garden, Florida, Orange County","Winter Garden, Florida",Winter Garden,Winter Garden,FL,Orange,Florida,28.5421,-81.5967
