city_id,State,County,State Abbreviation,city_name_id,city_state,city,City,state_id,county_name,state_name,lat,lng
0,New York,Queens County,NY,"New York, New York, Queens County","New York, New York",New York,New York,NY,Queens,New York,40.6943,-73.9249
1,California,Los Angeles County,CA,"Los Angeles, California, Los Angeles County","Los Angeles, California",Los Angeles,Los Angeles,CA,Los Angeles,California,34.1141,-118.4068
2,Texas,Harris County,TX,"Houston, Texas, Harris County","Houston, Texas",Houston,Houston,TX,Harris,Texas,29.786,-95.3885
3,Arizona,Maricopa County,AZ,"Phoenix, Arizona, Maricopa County","Phoenix, Arizona",Phoenix,Phoenix,AZ,Maricopa,Arizona,33.5722,-112.0892
4,Texas,Bexar County,TX,"San Antonio, Texas, Bexar County","San Antonio, Texas",San Antonio,San Antonio,TX,Bexar,Texas,29.4632,-98.5238
5,California,San Diego County,CA,"San Diego, California, San Diego County","San Diego, California",San Diego,San Diego,CA,San Diego,California,32.8313,-117.1222
6,Texas,Dallas County,TX,"Dallas, Texas, Dallas County","Dallas, Texas",Dallas,Dallas,TX,Dallas,Texas,32.7935,-96.7667
7,California,Santa Clara County,CA,"San Jose, California, Santa Clara County","San Jose, California",San Jose,San Jose,CA,Santa Clara,California,37.3012,-121.848
8,Texas,Travis County,TX,"Austin, Texas, Travis County","Austin, Texas",Austin,Austin,TX,Travis,Texas,30.3005,-97.7522
9,Florida,Duval County,FL,"Jacksonville, Florida, Duval County","Jacksonville, Florida",Jacksonville,Jacksonville,FL,Duval,Florida,30.3322,-81.6749
10,California,San Francisco County,CA,"San Francisco, California, San Francisco County","San Francisco, California",San Francisco,San Francisco,CA,San Francisco,California,37.7558,-122.4449
11,Ohio,Franklin County,OH,"Columbus, Ohio, Franklin County","Columbus, Ohio",Columbus,Columbus,OH,Franklin,Ohio,39.9862,-82.9855
12,Texas,Tarrant County,TX,"Fort Worth, Texas, Tarrant County","Fort Worth, Texas",Fort Worth,Fort Worth,TX,Tarrant,Texas,32.7817,-97.3474
13,Michigan,Wayne County,MI,"Detroit, Michigan, Wayne County","Detroit, Michigan",Detroit,Detroit,MI,Wayne,Michigan,42.3834,-83.1024
14,Texas,El Paso County,TX,"El Paso, Texas, El Paso County","El Paso, Texas",El Paso,El Paso,TX,El Paso,Texas,31.8476,-106.43
15,Tennessee,Shelby County,TN,"Memphis, Tennessee, Shelby County","Memphis, Tennessee",Memphis,Memphis,TN,Shelby,Tennessee,35.1087,-89.9663
16,Washington,King County,WA,"Seattle, Washington, King County","Seattle, Washington",Seattle,Seattle,WA,King,Washington,47.6211,-122.3244
17,Colorado,Denver County,CO,"Denver, Colorado, Denver County","Denver, Colorado",Denver,Denver,CO,Denver,Colorado,39.762,-104.8758
18,Massachusetts,Suffolk County,MA,"Boston, Massachusetts, Suffolk County","Boston, Massachusetts",Boston,Boston,MA,Suffolk,Massachusetts,42.3188,-71.0852
19,Oklahoma,Oklahoma County,OK,"Oklahoma City, Oklahoma, Oklahoma County","Oklahoma City, Oklahoma",Oklahoma City,Oklahoma City,OK,Oklahoma,Oklahoma,35.4676,-97.5136
20,Oregon,Multnomah County,OR,"Portland, Oregon, Multnomah County","Portland, Oregon",Portland,Portland,OR,Multnomah,Oregon,45.5371,-122.65
21,Wisconsin,Milwaukee County,WI,"Milwaukee, Wisconsin, Milwaukee County","Milwaukee, Wisconsin",Milwaukee,Milwaukee,WI,Milwaukee,Wisconsin,43.0642,-87.9675
22,Arizona,Pima County,AZ,"Tucson, Arizona, Pima County","Tucson, Arizona",Tucson,Tucson,AZ,Pima,Arizona,32.1541,-110.8787
23,California,Fresno County,CA,"Fresno, California, Fresno County","Fresno, California",Fresno,Fresno,CA,Fresno,California,36.783,-119.7939
24,California,Sacramento County,CA,"Sacramento, California, Sacramento County","Sacramento, California",Sacramento,Sacramento,CA,Sacramento,California,38.5677,-121.4685
25,California,Los Angeles County,CA,"Long Beach, California, Los Angeles County","Long Beach, California",Long Beach,Long Beach,CA,Los Angeles,California,33.7977,-118.167
26,Missouri,Jackson County,MO,"Kansas City, Missouri, Jackson County","Kansas City, Missouri",Kansas City,Kansas City,MO,Jackson,Missouri,39.1238,-94.5541
27,Arizona,Maricopa County,AZ,"Mesa, Arizona, Maricopa County","Mesa, Arizona",Mesa,Mesa,AZ,Maricopa,Arizona,33.4015,-111.7178
28,Georgia,Fulton County,GA,"Atlanta, Georgia, Fulton County","Atlanta, Georgia",Atlanta,Atlanta,GA,Fulton,Georgia,33.7628,-84.422
29,Colorado,El Paso County,CO,"Colorado Springs, Colorado, El Paso County","Colorado Springs, Colorado",Colorado Springs,Colorado Springs,CO,El Paso,Colorado,38.8674,-104.7605
30,Nebraska,Douglas County,NE,"Omaha, Nebraska, Douglas County","Omaha, Nebraska",Omaha,Omaha,NE,Douglas,Nebraska,41.2627,-96.0529
31,North Carolina,Wake County,NC,"Raleigh, North Carolina, Wake County","Raleigh, North Carolina",Raleigh,Raleigh,NC,Wake,North Carolina,35.8324,-78.6429
32,Florida,Miami-Dade County,FL,"Miami, Florida, Miami-Dade County","Miami, Florida",Miami,Miami,FL,Miami-Dade,Florida,25.784,-80.2101
33,California,Alameda County,CA,"Oakland, California, Alameda County","Oakland, California",Oakland,Oakland,CA,Alameda,California,37.7904,-122.2166
34,Minnesota,Hennepin County,MN,"Minneapolis, Minnesota, Hennepin County","Minneapolis, Minnesota",Minneapolis,Minneapolis,MN,Hennepin,Minnesota,44.9635,-93.2678
35,Oklahoma,Tulsa County,OK,"Tulsa, Oklahoma, Tulsa County","Tulsa, Oklahoma",Tulsa,Tulsa,OK,Tulsa,Oklahoma,36.1283,-95.9042
36,Ohio,Cuyahoga County,OH,"Cleveland, Ohio, Cuyahoga County","Cleveland, Ohio",Cleveland,Cleveland,OH,Cuyahoga,Ohio,41.4764,-81.6805
37,Texas,Tarrant County,TX,"Arlington, Texas, Tarrant County","Arlington, Texas",Arlington,Arlington,TX,Tarrant,Texas,32.6998,-97.125
38,California,Kern County,CA,"Bakersfield, California, Kern County","Bakersfield, California",Bakersfield,Bakersfield,CA,Kern,California,35.3529,-119.0359
39,Florida,Hillsborough County,FL,"Tampa, Florida, Hillsborough County","Tampa, Florida",Tampa,Tampa,FL,Hillsborough,Florida,27.9945,-82.4447
40,Hawaii,Honolulu County,HI,"Honolulu, Hawaii, Honolulu County","Honolulu, Hawaii",Honolulu,Honolulu,HI,Honolulu,Hawaii,21.3294,-157.846
41,Colorado,Arapahoe County,CO,"Aurora, Colorado, Arapahoe County","Aurora, Colorado",Aurora,Aurora,CO,Arapahoe,Colorado,39.7083,-104.7237
42,California,Orange County,CA,"Anaheim, California, Orange County","Anaheim, California",Anaheim,Anaheim,CA,Orange,California,33.839,-117.8574
43,California,Orange County,CA,"Santa Ana, California, Orange County","Santa Ana, California",Santa Ana,Santa Ana,CA,Orange,California,33.7367,-117.8819
44,California,Riverside County,CA,"Riverside, California, Riverside County","Riverside, California",Riverside,Riverside,CA,Riverside,California,33.9381,-117.3949
45,California,San Joaquin County,CA,"Stockton, California, San Joaquin County","Stockton, California",Stockton,Stockton,CA,San Joaquin,California,37.9765,-121.3109
46,Ohio,Hamilton County,OH,"Cincinnati, Ohio, Hamilton County","Cincinnati, Ohio",Cincinnati,Cincinnati,OH,Hamilton,Ohio,39.1413,-84.506
47,Ohio,Lucas County,OH,"Toledo, Ohio, Lucas County","Toledo, Ohio",Toledo,Toledo,OH,Lucas,Ohio,41.6638,-83.5827
48,North Carolina,Guilford County,NC,"Greensboro, North Carolina, Guilford County","Greensboro, North Carolina",Greensboro,Greensboro,NC,Guilford,North Carolina,36.0956,-79.8271
49,New Jersey,Essex County,NJ,"Newark, New Jersey, Essex County","Newark, New Jersey",Newark,Newark,NJ,Essex,New Jersey,40.7245,-74.1725
50,Texas,Collin County,TX,"Plano, Texas, Collin County","Plano, Texas",Plano,Plano,TX,Collin,Texas,33.0502,-96.7486
51,Nevada,Clark County,NV,"Henderson, Nevada, Clark County","Henderson, Nevada",Henderson,Henderson,NV,Clark,Nevada,36.0133,-115.0381
52,Nebraska,Lancaster County,NE,"Lincoln, Nebraska, Lancaster County","Lincoln, Nebraska",Lincoln,Lincoln,NE,Lancaster,Nebraska,40.8099,-96.6784
53,New York,Erie County,NY,"Buffalo, New York, Erie County","Buffalo, New York",Buffalo,Buffalo,NY,Erie,New York,42.9018,-78.8487
54,New Jersey,Hudson County,NJ,"Jersey City, New Jersey, Hudson County","Jersey City, New Jersey",Jersey City,Jersey City,NJ,Hudson,New Jersey,40.7184,-74.0686
55,California,San Diego County,CA,"Chula Vista, California, San Diego County","Chula Vista, California",Chula Vista,Chula Vista,CA,San Diego,California,32.6281,-117.0144
56,Florida,Orange County,FL,"Orlando, Florida, Orange County","Orlando, Florida",Orlando,Orlando,FL,Orange,Florida,28.4773,-81.337
57,Arizona,Maricopa County,AZ,"Chandler, Arizona, Maricopa County","Chandler, Arizona",Chandler,Chandler,AZ,Maricopa,Arizona,33.2825,-111.8514
58,North Carolina,Durham County,NC,"Durham, North Carolina, Durham County","Durham, North Carolina",Durham,Durham,NC,Durham,North Carolina,35.9792,-78.9022
59,Wisconsin,Dane County,WI,"Madison, Wisconsin, Dane County","Madison, Wisconsin",Madison,Madison,WI,Dane,Wisconsin,43.0822,-89.393
60,Texas,Lubbock County,TX,"Lubbock, Texas, Lubbock County","Lubbock, Texas",Lubbock,Lubbock,TX,Lubbock,Texas,33.5657,-101.8879
61,California,Orange County,CA,"Irvine, California, Orange County","Irvine, California",Irvine,Irvine,CA,Orange,California,33.6772,-117.7738
62,North Carolina,Forsyth County,NC,"Winston-Salem, North Carolina, Forsyth County","Winston-Salem, North Carolina",Winston-Salem,Winston-Salem,NC,Forsyth,North Carolina,36.1029,-80.261
63,Arizona,Maricopa County,AZ,"Glendale, Arizona, Maricopa County","Glendale, Arizona",Glendale,Glendale,AZ,Maricopa,Arizona,33.5791,-112.2311
64,Texas,Dallas County,TX,"Garland, Texas, Dallas County","Garland, Texas",Garland,Garland,TX,Dallas,Texas,32.91,-96.6304
65,Florida,Miami-Dade County,FL,"Hialeah, Florida, Miami-Dade County","Hialeah, Florida",Hialeah,Hialeah,FL,Miami-Dade,Florida,25.8696,-80.3045
66,Nevada,Washoe County,NV,"Reno, Nevada, Washoe County","Reno, Nevada",Reno,Reno,NV,Washoe,Nevada,39.5497,-119.8483
67,Arizona,Maricopa County,AZ,"Gilbert, Arizona, Maricopa County","Gilbert, Arizona",Gilbert,Gilbert,AZ,Maricopa,Arizona,33.31,-111.7463
68,Texas,Dallas County,TX,"Irving, Texas, Dallas County","Irving, Texas",Irving,Irving,TX,Dallas,Texas,32.8583,-96.9702
69,Arizona,Maricopa County,AZ,"Scottsdale, Arizona, Maricopa County","Scottsdale, Arizona",Scottsdale,Scottsdale,AZ,Maricopa,Arizona,33.6872,-111.8651
70,Nevada,Clark County,NV,"North Las Vegas, Nevada, Clark County","North Las Vegas, Nevada",North Las Vegas,North Las Vegas,NV,Clark,Nevada,36.2883,-115.0888
71,California,Alameda County,CA,"Fremont, California, Alameda County","Fremont, California",Fremont,Fremont,CA,Alameda,California,37.5265,-121.9843
72,California,San Bernardino County,CA,"San Bernardino, California, San Bernardino County","San Bernardino, California",San Bernardino,San Bernardino,CA,San Bernardino,California,34.1416,-117.2943
73,Washington,Spokane County,WA,"Spokane, Washington, Spokane County","Spokane, Washington",Spokane,Spokane,WA,Spokane,Washington,47.6671,-117.433
74,Iowa,Polk County,IA,"Des Moines, Iowa, Polk County","Des Moines, Iowa",Des Moines,Des Moines,IA,Polk,Iowa,41.5725,-93.6105
75,California,Stanislaus County,CA,"Modesto, California, Stanislaus County","Modesto, California",Modesto,Modesto,CA,Stanislaus,California,37.6375,-121.0028
76,North Carolina,Cumberland County,NC,"Fayetteville, North Carolina, Cumberland County","Fayetteville, North Carolina",Fayetteville,Fayetteville,NC,Cumberland,North Carolina,35.085,-78.9772
77,Washington,Pierce County,WA,"Tacoma, Washington, Pierce County","Tacoma, Washington",Tacoma,Tacoma,WA,Pierce,Washington,47.2431,-122.4531
78,California,Ventura County,CA,"Oxnard, California, Ventura County","Oxnard, California",Oxnard,Oxnard,CA,Ventura,California,34.1964,-119.1815
79,California,San Bernardino County,CA,"Fontana, California, San Bernardino County","Fontana, California",Fontana,Fontana,CA,San Bernardino,California,34.0968,-117.4599
80,California,Riverside County,CA,"Moreno Valley, California, Riverside County","Moreno Valley, California",Moreno Valley,Moreno Valley,CA,Riverside,California,33.9244,-117.2045
81,New York,Westchester County,NY,"Yonkers, New York, Westchester County","Yonkers, New York",Yonkers,Yonkers,NY,Westchester,New York,40.9466,-73.8673
82,Ohio,Summit County,OH,"Akron, Ohio, Summit County","Akron, Ohio",Akron,Akron,OH,Summit,Ohio,41.0798,-81.5219
83,California,Orange County,CA,"Huntington Beach, California, Orange County","Huntington Beach, California",Huntington Beach,Huntington Beach,CA,Orange,California,33.696,-118.0018
84,Arkansas,Pulaski County,AR,"Little Rock, Arkansas, Pulaski County","Little Rock, Arkansas",Little Rock,Little Rock,AR,Pulaski,Arkansas,34.7256,-92.3577
85,California,Los Angeles County,CA,"Glendale, California, Los Angeles County","Glendale, California",Glendale,Glendale,CA,Los Angeles,California,34.1819,-118.2468
86,Alabama,Mobile County,AL,"Mobile, Alabama, Mobile County","Mobile, Alabama",Mobile,Mobile,AL,Mobile,Alabama,30.6782,-88.1162
87,Michigan,Kent County,MI,"Grand Rapids, Michigan, Kent County","Grand Rapids, Michigan",Grand Rapids,Grand Rapids,MI,Kent,Michigan,42.9619,-85.6562
88,Utah,Salt Lake County,UT,"Salt Lake City, Utah, Salt Lake County","Salt Lake City, Utah",Salt Lake City,Salt Lake City,UT,Salt Lake,Utah,40.7776,-111.9311
89,Florida,Leon County,FL,"Tallahassee, Florida, Leon County","Tallahassee, Florida",Tallahassee,Tallahassee,FL,Leon,Florida,30.4551,-84.2527
90,Texas,Dallas County,TX,"Grand Prairie, Texas, Dallas County","Grand Prairie, Texas",Grand Prairie,Grand Prairie,TX,Dallas,Texas,32.6871,-97.0208
91,Tennessee,Knox County,TN,"Knoxville, Tennessee, Knox County","Knoxville, Tennessee",Knoxville,Knoxville,TN,Knox,Tennessee,35.9692,-83.9496
92,Massachusetts,Worcester County,MA,"Worcester, Massachusetts, Worcester County","Worcester, Massachusetts",Worcester,Worcester,MA,Worcester,Massachusetts,42.2705,-71.8079
93,California,Los Angeles County,CA,"Santa Clarita, California, Los Angeles County","Santa Clarita, California",Santa Clarita,Santa Clarita,CA,Los Angeles,California,34.4175,-118.4964
94,Rhode Island,Providence County,RI,"Providence, Rhode Island, Providence County","Providence, Rhode Island",Providence,Providence,RI,Providence,Rhode Island,41.823,-71.4187
95,California,Orange County,CA,"Garden Grove, California, Orange County","Garden Grove, California",Garden Grove,Garden Grove,CA,Orange,California,33.7787,-117.9601
96,Tennessee,Hamilton County,TN,"Chattanooga, Tennessee, Hamilton County","Chattanooga, Tennessee",Chattanooga,Chattanooga,TN,Hamilton,Tennessee,35.066,-85.2481
97,California,San Diego County,CA,"Oceanside, California, San Diego County","Oceanside, California",Oceanside,Oceanside,CA,San Diego,California,33.2247,-117.3083
98,Florida,Broward County,FL,"Fort Lauderdale, Florida, Broward County","Fort Lauderdale, Florida",Fort Lauderdale,Fort Lauderdale,FL,Broward,Florida,26.1412,-80.1464
99,California,Sonoma County,CA,"Santa Rosa, California, Sonoma County","Santa Rosa, California",Santa Rosa,Santa Rosa,CA,Sonoma,California,38.4458,-122.7067
100,California,San Bernardino County,CA,"Rancho Cucamonga, California, San Bernardino County","Rancho Cucamonga, California",Rancho Cucamonga,Rancho Cucamonga,CA,San Bernardino,California,34.1247,-117.5667
101,Arizona,Maricopa County,AZ,"Tempe, Arizona, Maricopa County","Tempe, Arizona",Tempe,Tempe,AZ,Maricopa,Arizona,33.3881,-111.9319
102,California,San Bernardino County,CA,"Ontario, California, San Bernardino County","Ontario, California",Ontario,Ontario,CA,San Bernardino,California,34.0393,-117.6064
103,Washington,Clark County,WA,"Vancouver, Washington, Clark County","Vancouver, Washington",Vancouver,Vancouver,WA,Clark,Washington,45.6366,-122.5967
104,Florida,Lee County,FL,"Cape Coral, Florida, Lee County","Cape Coral, Florida",Cape Coral,Cape Coral,FL,Lee,Florida,26.6443,-81.9957
105,Arizona,Maricopa County,AZ,"Peoria, Arizona, Maricopa County","Peoria, Arizona",Peoria,Peoria,AZ,Maricopa,Arizona,33.7843,-112.2989
106,Florida,Broward County,FL,"Pembroke Pines, Florida, Broward County","Pembroke Pines, Florida",Pembroke Pines,Pembroke Pines,FL,Broward,Florida,26.0128,-80.3382
107,California,Sacramento County,CA,"Elk Grove, California, Sacramento County","Elk Grove, California",Elk Grove,Elk Grove,CA,Sacramento,California,38.4161,-121.3842
108,Oregon,Marion County,OR,"Salem, Oregon, Marion County","Salem, Oregon",Salem,Salem,OR,Marion,Oregon,44.9233,-123.0244
109,California,Los Angeles County,CA,"Lancaster, California, Los Angeles County","Lancaster, California",Lancaster,Lancaster,CA,Los Angeles,California,34.6935,-118.1753
110,California,Riverside County,CA,"Corona, California, Riverside County","Corona, California",Corona,Corona,CA,Riverside,California,33.8616,-117.5649
111,Oregon,Lane County,OR,"Eugene, Oregon, Lane County","Eugene, Oregon",Eugene,Eugene,OR,Lane,Oregon,44.0564,-123.1174
112,California,Los Angeles County,CA,"Palmdale, California, Los Angeles County","Palmdale, California",Palmdale,Palmdale,CA,Los Angeles,California,34.5944,-118.1057
113,California,Monterey County,CA,"Salinas, California, Monterey County","Salinas, California",Salinas,Salinas,CA,Monterey,California,36.6883,-121.6317
114,Massachusetts,Hampden County,MA,"Springfield, Massachusetts, Hampden County","Springfield, Massachusetts",Springfield,Springfield,MA,Hampden,Massachusetts,42.1155,-72.5395
115,Texas,Harris County,TX,"Pasadena, Texas, Harris County","Pasadena, Texas",Pasadena,Pasadena,TX,Harris,Texas,29.6575,-95.1498
116,Colorado,Larimer County,CO,"Fort Collins, Colorado, Larimer County","Fort Collins, Colorado",Fort Collins,Fort Collins,CO,Larimer,Colorado,40.5477,-105.0656
117,California,Alameda County,CA,"Hayward, California, Alameda County","Hayward, California",Hayward,Hayward,CA,Alameda,California,37.6328,-122.0766
118,California,Los Angeles County,CA,"Pomona, California, Los Angeles County","Pomona, California",Pomona,Pomona,CA,Los Angeles,California,34.0585,-117.7626
119,North Carolina,Wake County,NC,"Cary, North Carolina, Wake County","Cary, North Carolina",Cary,Cary,NC,Wake,North Carolina,35.7819,-78.8195
120,Illinois,Winnebago County,IL,"Rockford, Illinois, Winnebago County","Rockford, Illinois",Rockford,Rockford,IL,Winnebago,Illinois,42.2596,-89.064
121,California,San Diego County,CA,"Escondido, California, San Diego County","Escondido, California",Escondido,Escondido,CA,San Diego,California,33.1348,-117.0723
122,Texas,Collin County,TX,"McKinney, Texas, Collin County","McKinney, Texas",McKinney,McKinney,TX,Collin,Texas,33.2016,-96.667
123,California,Santa Clara County,CA,"Sunnyvale, California, Santa Clara County","Sunnyvale, California",Sunnyvale,Sunnyvale,CA,Santa Clara,California,37.3836,-122.0255
124,California,Los Angeles County,CA,"Torrance, California, Los Angeles County","Torrance, California",Torrance,Torrance,CA,Los Angeles,California,33.8346,-118.3416
125,Connecticut,Fairfield County,CT,"Bridgeport, Connecticut, Fairfield County","Bridgeport, Connecticut",Bridgeport,Bridgeport,CT,Fairfield,Connecticut,41.1918,-73.1954
126,Colorado,Jefferson County,CO,"Lakewood, Colorado, Jefferson County","Lakewood, Colorado",Lakewood,Lakewood,CO,Jefferson,Colorado,39.6977,-105.1172
127,Florida,Broward County,FL,"Hollywood, Florida, Broward County","Hollywood, Florida",Hollywood,Hollywood,FL,Broward,Florida,26.0293,-80.1679
128,New Jersey,Passaic County,NJ,"Paterson, New Jersey, Passaic County","Paterson, New Jersey",Paterson,Paterson,NJ,Passaic,New Jersey,40.9147,-74.1624
129,New York,Onondaga County,NY,"Syracuse, New York, Onondaga County","Syracuse, New York",Syracuse,Syracuse,NY,Onondaga,New York,43.0407,-76.1437
130,Texas,Dallas County,TX,"Mesquite, Texas, Dallas County","Mesquite, Texas",Mesquite,Mesquite,TX,Dallas,Texas,32.7602,-96.5865
131,Ohio,Montgomery County,OH,"Dayton, Ohio, Montgomery County","Dayton, Ohio",Dayton,Dayton,OH,Montgomery,Ohio,39.7805,-84.2003
132,Tennessee,Montgomery County,TN,"Clarksville, Tennessee, Montgomery County","Clarksville, Tennessee",Clarksville,Clarksville,TN,Montgomery,Tennessee,36.5692,-87.3413
133,California,Orange County,CA,"Orange, California, Orange County","Orange, California",Orange,Orange,CA,Orange,California,33.8038,-117.8218
134,California,Los Angeles County,CA,"Pasadena, California, Los Angeles County","Pasadena, California",Pasadena,Pasadena,CA,Los Angeles,California,34.1597,-118.139
135,California,Orange County,CA,"Fullerton, California, Orange County","Fullerton, California",Fullerton,Fullerton,CA,Orange,California,33.8841,-117.9279
136,Texas,Collin County,TX,"Frisco, Texas, Collin County","Frisco, Texas",Frisco,Frisco,TX,Collin,Texas,33.156,-96.8216
137,Michigan,Macomb County,MI,"Warren, Michigan, Macomb County","Warren, Michigan",Warren,Warren,MI,Macomb,Michigan,42.4934,-83.027
138,Washington,King County,WA,"Bellevue, Washington, King County","Bellevue, Washington",Bellevue,Bellevue,WA,King,Washington,47.5951,-122.1535
139,South Carolina,Richland County,SC,"Columbia, South Carolina, Richland County","Columbia, South Carolina",Columbia,Columbia,SC,Richland,South Carolina,34.0378,-80.9036
140,Michigan,Macomb County,MI,"Sterling Heights, Michigan, Macomb County","Sterling Heights, Michigan",Sterling Heights,Sterling Heights,MI,Macomb,Michigan,42.5809,-83.0305
141,Connecticut,New Haven County,CT,"New Haven, Connecticut, New Haven County","New Haven, Connecticut",New Haven,New Haven,CT,New Haven,Connecticut,41.3113,-72.9246
142,Florida,Broward County,FL,"Miramar, Florida, Broward County","Miramar, Florida",Miramar,Miramar,FL,Broward,Florida,25.9773,-80.3351
143,California,Ventura County,CA,"Thousand Oaks, California, Ventura County","Thousand Oaks, California",Thousand Oaks,Thousand Oaks,CA,Ventura,California,34.1914,-118.8756
144,Iowa,Linn County,IA,"Cedar Rapids, Iowa, Linn County","Cedar Rapids, Iowa",Cedar Rapids,Cedar Rapids,IA,Linn,Iowa,41.9662,-91.6783
145,South Carolina,Charleston County,SC,"Charleston, South Carolina, Charleston County","Charleston, South Carolina",Charleston,Charleston,SC,Charleston,South Carolina,32.8168,-79.9687
146,California,Tulare County,CA,"Visalia, California, Tulare County","Visalia, California",Visalia,Visalia,CA,Tulare,California,36.3276,-119.3269
147,New Jersey,Union County,NJ,"Elizabeth, New Jersey, Union County","Elizabeth, New Jersey",Elizabeth,Elizabeth,NJ,Union,New Jersey,40.6658,-74.1913
148,Florida,Alachua County,FL,"Gainesville, Florida, Alachua County","Gainesville, Florida",Gainesville,Gainesville,FL,Alachua,Florida,29.6804,-82.3459
149,Colorado,Adams County,CO,"Thornton, Colorado, Adams County","Thornton, Colorado",Thornton,Thornton,CO,Adams,Colorado,39.9197,-104.9438
150,California,Placer County,CA,"Roseville, California, Placer County","Roseville, California",Roseville,Roseville,CA,Placer,California,38.7703,-121.3196
151,Texas,Dallas County,TX,"Carrollton, Texas, Dallas County","Carrollton, Texas",Carrollton,Carrollton,TX,Dallas,Texas,32.989,-96.8999
152,Florida,Broward County,FL,"Coral Springs, Florida, Broward County","Coral Springs, Florida",Coral Springs,Coral Springs,FL,Broward,Florida,26.2702,-80.2591
153,California,Ventura County,CA,"Simi Valley, California, Ventura County","Simi Valley, California",Simi Valley,Simi Valley,CA,Ventura,California,34.2663,-118.749
154,California,Contra Costa County,CA,"Concord, California, Contra Costa County","Concord, California",Concord,Concord,CA,Contra Costa,California,37.9722,-122.0016
155,Connecticut,Hartford County,CT,"Hartford, Connecticut, Hartford County","Hartford, Connecticut",Hartford,Hartford,CT,Hartford,Connecticut,41.7661,-72.6834
156,Washington,King County,WA,"Kent, Washington, King County","Kent, Washington",Kent,Kent,WA,King,Washington,47.3887,-122.2128
157,Arizona,Maricopa County,AZ,"Surprise, Arizona, Maricopa County","Surprise, Arizona",Surprise,Surprise,AZ,Maricopa,Arizona,33.6815,-112.4515
158,Texas,Denton County,TX,"Denton, Texas, Denton County","Denton, Texas",Denton,Denton,TX,Denton,Texas,33.2175,-97.1418
159,California,San Bernardino County,CA,"Victorville, California, San Bernardino County","Victorville, California",Victorville,Victorville,CA,San Bernardino,California,34.5277,-117.3536
160,California,Santa Clara County,CA,"Santa Clara, California, Santa Clara County","Santa Clara, California",Santa Clara,Santa Clara,CA,Santa Clara,California,37.3646,-121.968
161,California,Solano County,CA,"Vallejo, California, Solano County","Vallejo, California",Vallejo,Vallejo,CA,Solano,California,38.1125,-122.2342
162,Oklahoma,Cleveland County,OK,"Norman, Oklahoma, Cleveland County","Norman, Oklahoma",Norman,Norman,OK,Cleveland,Oklahoma,35.2335,-97.3471
163,Missouri,Jackson County,MO,"Independence, Missouri, Jackson County","Independence, Missouri",Independence,Independence,MO,Jackson,Missouri,39.0871,-94.3501
164,Tennessee,Rutherford County,TN,"Murfreesboro, Tennessee, Rutherford County","Murfreesboro, Tennessee",Murfreesboro,Murfreesboro,TN,Rutherford,Tennessee,35.849,-86.4121
165,Michigan,Washtenaw County,MI,"Ann Arbor, Michigan, Washtenaw County","Ann Arbor, Michigan",Ann Arbor,Ann Arbor,MI,Washtenaw,Michigan,42.2759,-83.731
166,California,Alameda County,CA,"Berkeley, California, Alameda County","Berkeley, California",Berkeley,Berkeley,CA,Alameda,California,37.8722,-122.276
167,Utah,Utah County,UT,"Provo, Utah, Utah County","Provo, Utah",Provo,Provo,UT,Utah,Utah,40.2457,-111.6457
168,California,Los Angeles County,CA,"El Monte, California, Los Angeles County","El Monte, California",El Monte,El Monte,CA,Los Angeles,California,34.0739,-118.0291
169,Michigan,Ingham County,MI,"Lansing, Michigan, Ingham County","Lansing, Michigan",Lansing,Lansing,MI,Ingham,Michigan,42.7142,-84.5601
170,California,Los Angeles County,CA,"Downey, California, Los Angeles County","Downey, California",Downey,Downey,CA,Los Angeles,California,33.9379,-118.1311
171,California,Orange County,CA,"Costa Mesa, California, Orange County","Costa Mesa, California",Costa Mesa,Costa Mesa,CA,Orange,California,33.6667,-117.9135
172,Colorado,Jefferson County,CO,"Arvada, Colorado, Jefferson County","Arvada, Colorado",Arvada,Arvada,CO,Jefferson,Colorado,39.832,-105.151
